comment_id,comment_parent_id,comment_body,comment_depth,comment_score,comment_created_utc
gaj9u21,t1_gaj80ej,"Well can you treat the OP on its own merit and stop extrapolating things.

By your tax logic I should settle down in Antarctica or Artic circle or same where in the middle of the ocean to save myself from been guilty of whataboutism.",2,-4,1604006223.0
gaijq4w,t1_gaif4um,"Not really. We have no right to tell others how to treat minorities when our own minorities are treated like shit  Macrons approach was wrong but Immys response was worse, like Erdogans.",2,22,1603994593.0
gainejm,t1_gaiiz3n,But muhh oSaMa BiN lAdeN sHaHeEd,2,12,1603996091.0
gaj2ht9,t1_gaiiz3n,"He's writing to the other leaders in a suggestion on how to maybe deal with those 

>plagued by heinous acts committed in the name of a hijacked ""Islam.""

It's a suggestion. A view on how things can be handled for the better. I don't quite recall a world leader who encourages people to go abroad and blow themselves up in places. When that day comes, maybe IK will write to them too. But his stance and message right now is evidently correct.",2,4,1604002658.0
gaj20x7,t1_gaic3ud,کی؟,2,1,1604002434.0
gaj3z7x,t1_gaitfq6,">Ah yes let's just completely ignore the reason they are leaving. Most of the refugees that have fled would love to return to their home. But foreign intervention has lead to the complete destruction of nations like Syria and Iraq. But you want to blame the religion right? Please explain to my where in the Quran it says that we should go into a random place with a suicide vest. The current extremist issue is a much more complex than you think, you simply can't just blame religion


For that matter, where does it say that you should even kill anyone who disrespects the Prophet? Kuffaar physically abused the prophet and he forgave most, if not all, during Fatah Makkah.

This is radicalisation whose cure is certainly not polarisation. Radicalisation essentially started with loss of law and order in middle eastern countries. Which was caused by wars waged by European countries. Enmity and polarisation leads to radicalisation of the oppressed i.e. the colonised, invaded and war torn countries. The solution was deep assistance and aid to the countries the Europeans destroyed. Leaving and maligning them led to enmity. A need for revenge on the ones who destroyed. And they came up with brainwashing their people through religion, which has been done even in Europe throughout history when they waged holy wars, and caused a massive uprising and radicalisation of many a people. The solution now is still the same. Reduce enmity, provocation, de-radicalise and fight the extremist mindset through education and help. Own up to, undeniably, the concequences of your own opression.",2,7,1604003367.0
gaj1f9z,t1_gaitfq6,"Ah yes let's just completely ignore the reason they are leaving. Most of the refugees that have fled would love to return to their home. But foreign intervention has lead to the complete destruction of nations like Syria and Iraq. But you want to blame the religion right? Please explain to my where in the Quran it says that we should go into a random place with a suicide vest. The current extremist issue is a much more complex than you think, you simply can't just blame religion.",2,13,1604002146.0
gaj2p0t,t1_gaitfq6,Bro your statements are so retarded I can't even.....what?,2,2,1604002753.0
gakp45t,t1_gaitfq6,"maybe the issue is the fact that colonizer countries shouldn’t have fucked up our countries so that we now have to go to the west to get opportunities in life

Maybe colonizer countries should apologize for ruining the infrastructure of the South and stop crying about the product of their own bullshit",2,1,1604036300.0
gaj7b61,t1_gaj5n3z,">It's a joke when leaders who are constantly trying to undermine citizen's rights attempt it.

I don't recall such allegation on IK but I see where you're coming from.

>to take moral positions on freedom, inclusion, progressive values etc

But that's not what's happening here. It's a suggestion. And it's on something that's damn near close to the hearts of 2 billion people.",2,2,1604004973.0
gb12oak,t1_gaieyb0,Yes cartoons vs forced conversion of children and pedophilia and blasphemy law wow both are same?,2,4,1604428081.0
gaifpsx,t1_gaieyb0,Yeah people sometimes are real smart here or so fuckin stupid,2,-3,1603993018.0
gainelj,t1_gaikad0,"Press 'X' to doubt.

Kartarpur and the temple in Islamabad are just a few of the things that spring to mind. Also the fact that women wearing burkinis aren't forced to strip naked on a public beach by the police.",2,6,1603996091.0
gaio1n9,t1_gaifb58,Bas koi kuch bhi bole to western masters hogaye. Sai jarahe ho bro.,2,11,1603996351.0
gaigl25,t1_gaie1e1,First of all ahmedis are not Muslims and that is not up for debate and secondly the treatment of ahmedis in Pakistan is very abhorrent and hypocritical. I mean minorities rights r protected not only in our Constitution but also most importantly in Islam and it is our duty to protects there life and right to live I mean what 90% of what r molvis teach in Pakistan is very unislamic like they make shit up like the green turban cunts who say and I kid u not not to walk on grass coz the prophet loved that colour and to worship a cat coz it had a shape on its head that resembled the prophets shoes. Like these molvis deserve to be killed. This govts attitude towards minorites is very positive but there is so much they can do to bring the proper Islamic attitude to Pakistan when we have Indian agents teaching there own form of Islam.,2,-8,1603993347.0
gaj0fak,t1_gaie1e1,">Ahmadi muslims

Ahmadis are NOT muslims, saying you are muslim does not make you one, your beliefs do.",2,-5,1604001663.0
gal8rj2,t1_gaigkb2,What do you mean. Except for the executive of president and prime minister a non Muslim can hold any office.,2,0,1604057027.0
gaiaojp,t1_gai3kuo,"yes i know but some people just dont want us to take a stance on this matter which is bs,what good thing has been done needs to be appreciated and yes we have a huge minority issue and our pm isnt doing smth about it but i feel like he's better than the previous Pm's regarding this matter.",2,3,1603990914.0
gaibu9a,t1_gahvxdi,"You live in Chicago, who is “we”.

I bet you don’t discredit the US government and its media when they are vocal about Chinese treatment of Muslims despite the atrocities the US has conducted in the Muslims world. 

But of course you are lining up to shoot down brown people about any misgivings they might have about colonialist powers disparaging Islam as an ideology after their racial supremacist ideals led to the loot, plunder, and destruction of non-white countries.

Quite sad and orientalist of you to be doing this.",2,17,1603991452.0
gai4eh1,t1_gahvxdi,[deleted],2,12,1603988014.0
gahzz83,t1_gahvxdi,[removed],2,8,1603985933.0
gahxfpw,t1_gahvxdi,"Brother, a$ I've $aid before, that i$ a completely different $ituation.",2,12,1603984727.0
gajnk5a,t1_gahvxdi,"your taxes go to bombing little aghfani children stfu, and dont try to speak for pakistanis",2,0,1604013315.0
galeo8g,t1_gaiz3y6,XD!!!!!,2,2,1604061679.0
gajdcrk,t1_gaiw0n3,Okay but tell me when was the last time liberal Pakistani did “constructive criticism” against Islamaphobia? Never. Also you say that because you’ve probably never lived in the west. Look at how black minorities are literally murdered by police in America. Look at how horribly natives are being treated/living in Canada and don’t get me started about Europe.,2,-6,1604007992.0
gai3yzk,t1_gai3pxm,"The answer you’re looking for is PPP, Pakistan’s liberal and secular party 🤡",2,6,1603987812.0
gaifeeb,t1_gaic0ws,"Other than Ahmedis, there isnt really any law threatning minorities.",2,2,1603992900.0
gaig3ul,t1_gaic0ws,Punish for what?,2,-4,1603993165.0
gajrype,t1_gaj7xdt,"More like

""Oh these people are being discriminated and killed by Muslims""

""Ok, here is the state's stamp of approval, now you guys can do it legal. You're welcome bruzzer, Naaray Takbeer""

Crowd goes ""Allah ho Akbar""",2,6,1604015706.0
gaj82hf,t1_gaimmfk,Bro this is nonsense.  Don't believe it lol.  This is literally oh this group of people are discriminating and killing people so to put an end to it we'll do it ourselves.,2,2,1604005344.0
gaiucfz,t1_gaimmfk,Yeah I mean the alcohol drinking Casino Gambling Zanmindar socialist passed that law. Do you really think he has a personal conviction that Ahmadiyya aren't muslim? He was one of the main causes behind 1971 and he at least somewhat learned that compromise is key,2,2,1603998861.0
gan4tpu,t1_galo73z,"You guys, are you our Indian friends?",2,1,1604094091.0
gmytx3j,t1_gaj8dlo,">Did you not here about the case of Ahmadis who were arrested for removing posters that had offensive things written about them.

Okay. But instead of being so vague please tell what did the poster contain?

About that British tout Mirza not being a prophet? Ahymedis being called non-Muslims?

Well, because that tout wasn’t a prophet and Ahymedis aren’t Muslims. Pakistan has a state religion, it’ll judge things based on that. As Pakistan has a state religion it will judge truth and falsehood based on that.

France is a secular state. That’s the difference. Grow up you idiots.

Really if you think religion should be part of state, go move to some secular state.",2,0,1613068438.0
gmytbot,t1_gajdewq,It literally is you idiot. Muslims children are being arrested if they say making images of Prophet (S.W.A) is wrong because to France that’s supporting terrorism.,2,1,1613068189.0
gajswny,t1_gajsvtu,"Jimmy Engineer (born August 1954, Loralai, Balochistan) is a Pakistani artist, social worker, philanthropist and stamp designer.
He is a Zoroastrian.

More details here: https://en.wikipedia.org/wiki/Jimmy_Engineer 



*This comment was left automatically (by a bot). If something's wrong, please, report it.*

*Really hope this was useful and relevant :D*

*If I don't get this right, don't get mad at me, I'm still learning!*",3,11,1604016224.0
gajx7m7,t1_gajsvtu,[deleted],3,5,1604018597.0
gall7cv,t1_gajsvtu,"> I could go into detail if you'd like

Would love to hear, go on",3,2,1604065707.0
gpd46o1,t1_gajsvtu,For sure man there are definitely some things that can be improved. This coming from a Muslim at the moment sadly Pakistan isn’t very diverse with religion. Most people are very accepting but with the majority of the population being Muslim. Muslim Pakistanis aren’t too used to being around from people who believe in a different religion. Hopefully will improve in the future.,3,2,1614646897.0
gdrapx8,t1_gajsvtu,Why don't you emmigrate to other countries.. like uk usa  russia  sri lanka india.. india is near.. did you ever think of emmigrating??,3,0,1606478094.0
gal1xwv,t1_gajsvtu,"Hey! I'd like to know more about the how Hindus are affected there. I could google it but i wanted a more personal view since discrimination and stuff happens to minorities all over the world but like in India, the educated circles don't even consider religion when interacting with a person so the ground realities are different.

I think i should disclose I'm an Indian Hindu and i came on this subreddit to see how is the general consensus on the attacks in France. It's obvious that y'all are against them but there might be a few who think it's justified and I wanted to know what their thought process was.",3,-1,1604049957.0
galogt7,t1_gajhogg,which place in india did you go to eat?,3,2,1604067529.0
gam23ds,t1_galtyg6,"I interact with a lot of Pakistanis here in the US. Unfortunately, a lot of them belong to my own extended family. 

Pakistanis, and I assume, other muslims from similar background countries have a dual problem. They have an inferiority complex when it comes to the white man. But also a superiority complex when it comes to non-white people, especially blacks, Indians and Hispanics. We also have a terrible understanding of all of these demographic groups. The white man is this perfect species that can do no wrong. And for some reason, there is this weird idea that every white person is a devout christian, and is super into religion. This is NOT true, especially in bigger states like NY and California. Hardly anyone even visits church anymore and most people are strongly secular, preferring not to discuss religion with others. 

The admiration for the white man is accompanied with an equal amount of contempt for Indians. I can't believe how much hatred expat Pakistanis have for Indians. Even though they are community most similar to us, and having a lot of common issues and goals. It is actually just a veil for jealousy though. Most indians are very well to do, working in high paying jobs such as software and doctors. They have homes most Pakistanis can only dream of owning. So the automatic assumption is that they must have ""cheated"" their way to success. Fun fact though, almost every pakistani who works in the motel or gas station business cheats on their taxes here. They hide cash income, so that they can get government benefits, as well as lowering their tax income. The rationale is ""we are poor hard working immigrants, and we deserve to keep our money"", even if they have been their for 2p years and own 5 gas stations. 

I could go on, but I think you get the gist.",3,1,1604074406.0
gaisc50,t1_gairxsu,My favorite scape-goat label is yahoodi agent/zionist. IDK why every time someone calls me that I feel invincible and on top of the world.,3,23,1603998060.0
gajt24y,t1_gajl6jg,Don’t think too much goy!,3,4,1604016307.0
gakgvsl,t1_gajl6jg,"Should I explain it to you or are you gonna google it, because you dont know what anti semantic means,Semitic is used for Arabs but anti Semitic is used for hate red of Jews.",3,2,1604029886.0
gaiqmor,t1_gaipr1y,🙏,3,6,1603997401.0
gais5ns,t1_gaipr1y,brrrrrr,3,1,1603997991.0
gaj89sn,t1_gaii2ua,"It’s a common tactic to make your point of view seem persecuted to garner sympathy from people. 

Criticizing China is not only rampant on this sub but the whole of reddit has become overtly anti-China. 

But of course some people only want to criticize China and not ex-colonial powers due to mental slavery and deep rooted racism.",3,11,1604005446.0
gajaaaz,t1_gaj9u21,"Hahah not my logic buddy, your own logic!

You were quick to talk down to the “muslim world” and rubbish its criticism of France cause of whatever reason.

But when I’m discrediting your opinion for the things you don’t have a perfect record on now I’m extrapolating? 

Treat the Muslim worlds criticism of France on its own merit next time if you want to be afforded the same privilege!",3,11,1604006449.0
gailrot,t1_gaijq4w,I'm talking about reddit's obsession with turning any criticism of west to CHINA.,3,13,1603995424.0
gdm21rm,t1_gaijq4w,And why should we care?,3,1,1606352840.0
gaj2ibv,t1_gainejm,What?,3,6,1604002665.0
gaj34qs,t1_gaj20x7,[deleted],3,1,1604002963.0
gaj68eh,t1_gaj3z7x,"Surah 3:151: “We shall cast terror into the hearts of those who disbelieve""


Surah 2:191: “And kill them (non-Muslims) wherever you find them ... kill them. Such is the recompense of the disbelievers""


Surah 9:5: “Then kill the disbelievers (non-Muslims) wherever you find them, capture them and besiege them, and lie in wait for them in each and every ambush""",3,2,1604004456.0
gaj3tu3,t1_gaj1f9z,"For that matter, where does it say that you should even kill anyone who disrespects the Prophet? Kuffaar physically abused the prophet and he forgave most, if not all, during Fatah Makkah.

This is radicalisation whose cure is certainly not polarisation. Radicalisation essentially started with loss of law and order in middle eastern countries. Which was caused by wars waged by European countries. Enmity and polarisation leads to radicalisation of the oppressed i.e. the colonised, invaded and war torn countries. The solution was deep assistance and aid to the countries the Europeans destroyed. Leaving and maligning them led to enmity. A need for revenge on the ones who destroyed. And they came up with brainwashing their people through religion, which has been done even in Europe throughout history when they waged holy wars, and caused a massive uprising and radicalisation of many a people. The solution now is still the same. Reduce enmity, provocation, de-radicalise and open arms. Own up to, undeniably, to the concequences of your opression.",3,8,1604003295.0
gaj2u6d,t1_gaj1f9z,"Surah 3:151: “We shall cast terror into the hearts of those who disbelieve""


Surah 2:191: “And kill them (non-Muslims) wherever you find them ... kill them. Such is the recompense of the disbelievers”


Surah 9:5: “Then kill the disbelievers (non-Muslims) wherever you find them, capture them and besiege them, and lie in wait for them in each and every ambush”


**The religion of peace.**",3,-3,1604002821.0
gakico2,t1_gaj7b61,"I understand that Muslims are sensitive about religion but we need to acknowledge that the brunt is felt in liberal countries and no one seems to utter a bad word about China which is the real perpetrator of evil against Muslims. It may seem like an outrage of convenience, especially for those in liberal democracies.",3,-1,1604030919.0
gaikfx9,t1_gaifpsx,Piss off. You're the guy who was sympathising with the Peshawar court killer when that thread came up in this sub.,3,20,1603994890.0
gaioneu,t1_gainelj,[deleted],3,13,1603996603.0
galxr09,t1_gainelj,May I remind forced coversion to Islam is perfectly legal,3,2,1604072281.0
gakzm7o,t1_gainelj,"> Kartarpur and the temple in Islamabad are just a few of the things that spring to mind.

So Pakistan decided after decades to let minorities build their religious buildings and all of a sudden they are not being discriminated anymore. Is that your criteria for treating them better. Just yesterday the front page story was of a christian girl being kidnapped, forcefully converted, raped while the judges decided to send her back with her rapist. This wasnt the first case, and I doubt its going to be the last with how people like you just glance over press 'X' whenever this topic comes up.",3,2,1604047289.0
gajq08t,t1_gaio1n9,"Nahi janab, ahsi koi baat nahi ha. Hum Indians and yahoodi sazishon ko be equally blame karta hein jub humara pass koi jawab na araha ho. Ain't no discrimination in the blame game.",3,4,1604014638.0
gaii9le,t1_gaigl25,"Why aren’t they Muslim?
Attitudes like that are the reasons that ahmadis are murdered. Why can’t they say they are muslims? 
They believe in Allah, the Quran, prophet Muhammad, and pray 5 times a day. 
They have some difference in beliefs but what sect doesn’t?",3,5,1603994025.0
gal90ag,t1_gal8rj2,"Only 10 allowed. This is limiting factor. If they have sufficient public support and ability to run government then why not?  
  
Moreover there is almost no representation in army.  
Have you seen what Indian do? They do not send Hindu regiments to fight in war at all.  Instead sacrifice life of Sikhs and Nepali Gurkhas every time.  
1962 invasion of Lahore was done by Sikh regiment and so was defence of 1971 in Rajasthan.  
Gurkha's were sent to fight in Kargil.  
They even have Muslims in army.  
When any of them die they use it as a means to gain support of minorities in India.",3,1,1604057241.0
gal706w,t1_gaibu9a,"dude i’ve lived a long time in Pakistan as a minority, my parents (along with most my family) still do. i’m not lining up to shoot anyone, nothing said in the meme isn’t true, the US isn’t being discussed (or praised) Pakistan is, minorities don’t feel safe here. if you’re way too bothered by the post, don’t look at it, going through my profile on reddit and making assumptions about me doesn’t make you very smart either.",3,-1,1604055386.0
gaib618,t1_gahzz83,"Removal Reason: Deemed to be obscene, indecent or profane.",3,6,1603991140.0
gajtkdd,t1_gajnk5a,"Pakistan allowed them to use the ports, highways, airfields, and other military infrastructure to help them bomb little afghani children. Lekin tab unse paise milrahe the so sab theek tha.

Today, we train and provide support to Saudi soldiers in killing little Yemeni children, our ex-Army Chief is leading the Arab forces in bombing Yemeni children, wo sab theek hai?

STFU with your false nationalism.",3,7,1604016585.0
gajoyfi,t1_gajnk5a,"Haan haan, khali tumko license mila hua hai Pakistan ke liye bolne ka",3,2,1604014068.0
gakpykc,t1_gajdcrk,"That is such a lacking argument. Liberals do stand up against islamophobia Ironically only liberals speak against Islamophobia in the west, just try to sit down with a Christian Right in usa. I don’t get your stance, you want liberals to praise Pakistan and only criticise the west?",3,4,1604037059.0
gai50ta,t1_gai3yzk,"PPP isn’t secular, if this was a sarcasm then excuse my lack of humour while discussing such a disgusting situation. If you are criticising just PPP then you are wrong because this happens in other provinces as well. The federal government isn’t any better than PPP on this issue. Minorities in pakistan are discriminated and If you think otherwise then there isn’t a point in arguing with you",3,6,1603988302.0
gaibpuw,t1_gai3yzk,fact. But ppp they are secular socialists not liberal. Kr at least they used to be.,3,0,1603991395.0
gaj0afr,t1_gaifeeb,"There is, anyone can convert from Christianity/Hinduism etc to Islam but nobody can convert from Islam to another religion or nobody can go back to his previous religion even if the courts find out it was a forced conversion. Their properties are encroached upon by the state (Hindu Gymkhana was turned into NAPA in Karachi), Mohatta Palace also belonged to a Hindu Marwari seth.  

India has only started discriminating Muslim recently (in terms of legislation) otherwise the state and the constitution were secular and gave them equal rights. That's one of the reasons that 'sickular' became a term of contempt in India now. The law still accepts Ahmedis as Muslims there, even though it was a long shot but we made discriminatory laws against Non-Muslims i.e. they can never become the President, Prime Minister of the country.",3,11,1604001599.0
gaiowtu,t1_gaifeeb,Is threatening 1 minority ok? The French aren't threatening anyone other than Muslims either,3,12,1603996712.0
gaijmm7,t1_gaifeeb,Thats true but for me one is too many.,3,0,1603994553.0
gaiji9r,t1_gaig3ul,for practicing thier religion.,3,4,1603994506.0
galt8he,t1_gaj82hf,"OK. Fair point.

The government(at least the last few governments) are helpless. Look at what happened when they tried to repeal some of the laws concerning Ahmadis during the last days of Nawaz as the PM.

[https://www.washingtonpost.com/news/monkey-cage/wp/2017/12/08/whats-behind-the-islamist-protests-in-pakistan/](https://www.washingtonpost.com/news/monkey-cage/wp/2017/12/08/whats-behind-the-islamist-protests-in-pakistan/)",3,1,1604070010.0
gaiy9xe,t1_gaiucfz,Are you talking about Bhutto?,3,1,1604000657.0
gaopemc,t1_gan4tpu,"Just because other Pakistanis have a different opinion from you, it doesn't mean they are anti Pakistani or Indian. Learn to accept differences of opinion.",3,2,1604138019.0
gmz773f,t1_gmytbot,Source?,3,1,1613074016.0
gaks49a,t1_gajswny,Good bot.,4,2,1604039123.0
gajydls,t1_gajx7m7,[deleted],4,10,1604019241.0
galm4qq,t1_gall7cv,[deleted],4,3,1604066233.0
gaj6fyu,t1_gaisc50,Everything is a yahudi sazish /s,4,17,1604004558.0
gakirfm,t1_gakgvsl,"Apparently you are such a super genius that you don't  even know that words have meaning.   
Semite are a group of people, with Arabs being the largest member of that group.   
Anti means against  
Anti-Semite thus means against sematic people.   


Now just because Jews co-opted the term doesn't mean its right and should just accept it.   


Arabs need to take that word back and make it represent anti-sematic people as its literal meaning.",4,0,1604031214.0
gakh0xo,t1_gaj89sn,Key word “ex”,4,1,1604029984.0
gajbif6,t1_gajaaaz,"Let’s agree to disagree on our views. 

going back to the OP Immy is NO POSITION to preach about safeguarding minorities. PERIOD.",4,-13,1604007063.0
gaimxz8,t1_gailrot,We rely on China so we can't say shit.,4,12,1603995905.0
gajj930,t1_gaj2ibv,I was reply to the part where he said where's IKs letter to fundamentalists. IK thinks Bin Laden is a shaheed.,4,-2,1604011023.0
gaj42z3,t1_gaj34qs,Akkoi Senpai?,4,1,1604003417.0
gaj7jmk,t1_gaj68eh,"And like I said before you copy pasted the same bullshit,

>Yeah, the exact typical move by a person like you. You took all those ayyah out of context.

>Thank you for your opinion. It was worthless.

>I'll link an answer to one the Ayahs ypu pointed out. I'm sure you're smart enough to find the context behind the rest. I mean, gow dumb do you have to be to use out of context verses of the Quran to malign islam in front of Muslims who've read both the Quran and it's Tafseer. If you're an apostate, I'd suggest you do some research before making an idiotic decision. It's the most logical thing to do, right? But I'm sure you're just an edgy teen using the knowledge he gained from surfing random websites.

>It's a pity. 

>https://discover-the-truth.com/2014/03/04/quran-95-sword-verse/

>*Atheists. The ones who were supposed to be smart*",4,6,1604005089.0
