comment_id,comment_parent_id,comment_body,comment_depth,comment_score,comment_created_utc
gal1ynm,t1_gaj68eh,"Are you even trying? For 9.5 literally the NEXT VERSE says:
 >""And if anyone of the polytheists asks you for protection, give him protection so that he may hear the Word of God; then escort him to his place of safety. That is because they are a people who do not know.""

The verse directly before says:
>Except for those among the polytheists with whom you had made a treaty, and did not violate any of its terms, nor aided anyone against you. So fulfill the treaty with them to the end of its term. God loves the righteous.

Clearly this is talking about those who violated the peace treaty with the muslims and attacked them. You can see this in 9:1
>A declaration of immunity from God and His Messenger to the polytheists with whom you had made a treaty.

If you had ever picked up a quran in your life you would know this

For 2.191 

Again, literally the next verse says
>And if they cease, then indeed, Allah is Forgiving and Merciful.

And the verse after this says
>If they cease hostilities, there can be no [further] hostility, except towards aggressors.

Clearly talking about people who attacked the muslims first

3:151 
Again if you read this chapter and the verses before and after, you would see that it is clearly talking about a war (the battle of uhud)

Why are atheists so stupid? Clearly you have never read the quran before, so dont talk about it, you're making a fool of yourself",4,0,1604049980.0
gajnehq,t1_gaj2u6d,"“The promise of casting awe and fear into the hearts of the disbelievers in this verse was made in the background of the battle of Uhud **when the disbelievers of Arabia marched back to Makkah without any obvious reason and inspite of defeat overtaking Muslim (Baydawi). However, after having covered a certain distance on their way to Makkah, they awoke to their folly. When they thought of marching back to Madinah, Allah Almighty filled their hearts with such awe and fear that they could not muster the courage to do so**. The most they could do was to hire a Madinah-bound villager to go there and tell Muslims that theu were coming back. But, this whole deal came into the knowledge of the oly Prophet (p) in Madinah through revelation. He marched to Hamra al-Asad to apprehend them but they had already run away from there. This was the background in which the present verse was revealed.”

First one

**2:190** **Fight in the way of Godthose who fight you but do not transgress. Indeed. God does not like transgressors.**  
**2:191 And kill them wherever you find them and** **expel them from wherever they have expelled you,** **and fitnah \[Persecution\] is worse than killing. And** **do not fight them at al-Masjid al- Haram until they fight you there. But if they fight you, then kill them. Such is the recompense of the disbelievers.**  
**2:192** **And if they cease, then indeed, God is Forgiving and Merciful.**  
**2:193** **Fight them until there is no \[more\] fitnah \[Persecution\]** **and \[until\] worship is for God. But if they cease, then there is to be no aggression except against the oppressors.** 

The second one is just basic lying at this point, your making a fool out of yourself.

The third one is reffering to the Romans, talking about ROMANS,

[http://englishtafsir.com/Quran/9/index.html](http://englishtafsir.com/Quran/9/index.html) Read if you want a history lesson

The quran in no way shape or for has ever told muslims to kill other non muslims for religion, I've read it in 2 languages, you havent read it once, sure it tells people to kill gay people but thats not the argument youre making.",4,4,1604013231.0
gaj6iyv,t1_gaj2u6d,[deleted],4,8,1604004597.0
gakpc8d,t1_gaj2u6d,boiiiii if all ~2 billion Muslims in the world were idiotic like u and cherry picked n took all these verses off context all y’all would be dead 🙄,4,2,1604036498.0
gaj6ymu,t1_gaj2u6d,"Yeah, the exact typical move by a person like you. You took all those ayyah out of context.

Thank you for your opinion. It was worthless.

I'll link an answer to one the Ayahs ypu pointed out. I'm sure you're smart enough to find the context behind the rest. I mean, gow dumb do you have to be to use out of context verses of the Quran to malign islam in front of Muslims who've read both the Quran and it's Tafseer. If you're an apostate, I'd suggest you do some research before making an idiotic decision. It's the most logical thing to do, right? But I'm sure you're just an edgy teen using the knowledge he gained from surfing random websites.

It's a pity. 

https://discover-the-truth.com/2014/03/04/quran-95-sword-verse/

*Atheists. The ones who were supposed to be smart*",4,1,1604004806.0
gaikss1,t1_gaikfx9,"Yes I was sympathizing with being harsh on the false prophets and false Muslims but not to kill them, if however I said I was for their killing(I highly doubt it tbh) I grew up as an individual and don’t murder  is not a solution to everything",4,-11,1603995042.0
gail559,t1_gaikfx9,*think murder,4,-2,1603995181.0
gaip1m9,t1_gaioneu,"No ones arrested lol, plenty of the muslims eat in ramadan too.

The abuse isn't government sanctioned, can't blame the gov for the actions of some fazlutards",4,2,1603996767.0
gal3bsd,t1_gakzm7o,"Yeah Sindh has major issues and local authority shouldn't fail people in this way. Not our fault that the PPP has decimated Sindh to the point any wadera wala can get away with anything.

The national government is pro minorities, whether you like or not.

Maybe we should be like France, if you see a woman in an abaya then the police should be allowed to put a gun to her head and strip her naked for muh republic.",4,2,1604051524.0
gajqht4,t1_gajq08t,"Woii to yaar. Pata nai hum log kabhi khud ko kyu nahi dekhte. Jab apni khaamiyo ko manenge hi nahi to improvement kaise aayegi? Jab koi baat karo ko western/indian/yahoodi saazish ka thappa lagjata hai. Bas Lumber 1 lumber 1 karte raho, to sab khush hain.",4,2,1604014904.0
gaik1kd,t1_gaii9le,idk if it's right or not but Admedis don't believe in Prophet Muhammad (SAW) as the last Prophet... which is required to believe as a Muslim.,4,3,1603994731.0
gaimk0x,t1_gaii9le,"Islam is 3 very simple things which once u do and believe in you become muslim :  tawheed , quran and hadith. Refusal to believe and act in anyone on these will result in that person not being a Muslim. Ahmedis don't believe in tawheed.",4,-6,1603995749.0
gal9jas,t1_gal706w,"You didn’t answer my question, do you discredit the US government and its media as hypocrites when they complain about human rights abuses in other countries like you do with Pakistan and Pakistanis?",4,4,1604057697.0
gajua9t,t1_gajtkdd,"doesn't change the fact that an American isnt a Pakistani, you arent a Pakistani if you live in america.

When did i support any of that? I am not the one being a hypocrite, OP is the one expecting pakistan to call out atrocities in other countries yet directly financing murder. OP should know that both him and the state of Pakistan have thier hands tied behinds thier back and have no choice but to comply with these atrocities. 

Tell me , what is wrong with nationalism? What is wrong with wanting what's best for your country over other countries?",4,-3,1604016985.0
gajrxxo,t1_gajoyfi,"mein pakistan mein rehta hun, amreeka mein reh karkoipakistan nahi ho sakta",4,3,1604015693.0
gaibfbo,t1_gai50ta,[deleted],4,2,1603991260.0
gajqr1o,t1_gaiowtu,"The French are not killing, raping or refusing to sell goods to Muslims in France but this stuff is happening in Pakistan and India with their minorities. I think minorities would actually be happy being treated in Pakistan like how the French are treating Muslims, at least they can live without fear for their life.",4,4,1604015044.0
gaip4v5,t1_gaiji9r,Please give me an example.,4,-2,1603996801.0
gaiyd8b,t1_gaiy9xe,Yup Zulfiqar Ali Bhutto,4,1,1604000699.0
gaotv9n,t1_gaopemc,"Minorities are not in concentration camps in Pakistan like they are in india and china. You guys possibly are over-woke. Its like you are complaining about yourself, if it pains you that much go and help someone start a movement. Rather then bitch about it in internet comments",4,1,1604143023.0
gn1mhu2,t1_gmz773f,"[https://www.youtube.com/watch?v=PRFbCZzfW5I](https://www.youtube.com/watch?v=PRFbCZzfW5I)  


[https://www.youtube.com/watch?v=OMz7H6u2MZ0](https://www.youtube.com/watch?v=OMz7H6u2MZ0)  


[https://www.trtworld.com/video/social-videos/french-imam-on-trial-for-suggesting-erdogan-handled-covid-crisis-better-than-macron/60202dcf73de31001766644d](https://www.trtworld.com/video/social-videos/french-imam-on-trial-for-suggesting-erdogan-handled-covid-crisis-better-than-macron/60202dcf73de31001766644d)",4,1,1613124953.0
gajyeju,t1_gajydls,"It looks like you shared an AMP link. These should load faster, but Google's AMP is controversial because of [concerns over privacy and the Open Web](https://www.reddit.com/r/AmputatorBot/comments/ehrq3z/why_did_i_build_amputatorbot). Fully cached AMP pages (like the one you shared), are [especially problematic](https://www.reddit.com/r/AmputatorBot/comments/ehrq3z/why_did_i_build_amputatorbot).

You might want to visit **the canonical page** instead: **[https://theconversation.com/irans-secular-shift-new-survey-reveals-huge-changes-in-religious-beliefs-145253](https://theconversation.com/irans-secular-shift-new-survey-reveals-huge-changes-in-religious-beliefs-145253)**

*****

 ^(I'm a bot | )[^(Why & About)](https://www.reddit.com/r/AmputatorBot/comments/ehrq3z/why_did_i_build_amputatorbot)^( | )[^(Summon me with u/AmputatorBot)](https://www.reddit.com/r/AmputatorBot/comments/cchly3/you_can_now_summon_amputatorbot/)",5,2,1604019256.0
galrw2v,t1_galm4qq,"Yeah, it is close to what i was expecting. The subcontinent is just a huge trashcan.",5,3,1604069324.0
galiyra,t1_gaj6fyu,Chips wala bhi?,5,2,1604064405.0
galu40c,t1_gaj6fyu,Yahoodi sazish intensifies.,5,1,1604070458.0
gakjiq7,t1_gakirfm,"But the guy(the one saying Quran has anti-Semitic quotes)was using it in context with Jews, you’re going on a ramble that should not be going on.

You’re the one acting smart.",5,3,1604031771.0
gajcdnr,t1_gajbif6,"LOL and you are in no position to be moralizing to Pakistanis about what they should be upset about. PERIOD

Have a nice day :)",5,11,1604007500.0
gaioivl,t1_gaimxz8,"More like we don't want cold war 2.0 near us again that the US is trying to stir up.


We could use those vocational camps for half of our population too.",5,-2,1603996549.0
gajmiyb,t1_gajj930,[removed],5,1,1604012764.0
gaj4c3g,t1_gaj42z3,[deleted],5,1,1604003539.0
gaj9op6,t1_gaj6iyv,"Your translation still calls for the killing of nonbelievers, so I dont really get your point?

And isn't it your religion that has people chopping off heads and being condemned worldwide? Why would I be the one with shame here? I can't wait for the rest of the world to realize China has it right this time and we should just eliminate your religion and its people all together.",5,-6,1604006148.0
gaj8i5w,t1_gaj6ymu,"You have people in your religion interpreting those lines the same way I did and using it as an excuse to chop peoples heads off, but sure let's just pretend those lines don't mean what they say.

You being brainwashed all your life to believe in fairytales discredits any kind of logic you think you have, your bias isn't a positive here. My interpretation is how most would read that, not some edgy take. On top of that, I would need to have been brainwashed as a child as well for me to be an apostate. Luckily for me my parents didn't abuse me like that.

It is a pity such a large amount of our population believes in fairytales, you are correct",5,3,1604005560.0
gaisuqr,t1_gaikss1,"Not too hard to look up that post.

In response to some guy who asked whether Islam was in danger due to 1 guy (the victim in the Peshawar court murder) you said

>That 1 person, will sprout to 10 other people that are ready to cause mischief. You can’t let go of even that 1 person because you have to create an example out of it

So again, piss off terrorist sympathiser. You don't have to deal with this shit while you stay in Canada. But you still support terrorists in Pak. Piss off.",5,15,1603998265.0
gaipxsq,t1_gaip1m9,[deleted],5,14,1603997116.0
galanei,t1_gal3bsd,"It doesnt happen in only Sindh. Thats the whole point. There have been cases of kidnapping and forced conversions where the judge sent the girl back to her rapist in Punjab aswell. Agar sirf Sindh mein horaha hota to baat alag thi. Magar yahan per to har jaga per tamasha machaya hua hai. 


https://www.eternitynews.com.au/opinion/14-year-old-christian-girl-in-pakistan-escapes-forced-marriage-conversion/



>any wadera wala can get away

Why do you think its only waderas. The last couple cases happened in Karachi. Living in Karachi, I dont think there are many waderas here. 

>The national government is pro minorities, whether you like or not.

The national government hasnt done much in anyway to be called pro-minority. Maybe in their heart they are. But action matters. You cant just change things with good will. Why is it that Ahmedis have to be humiliated by forcing the muslims to call Mirza Ghulam Ahmed a liar. Why is there more outrage from IK on the France end when the minorities in this country are suffering. And he is silent. He can actually do something about the minorities in Pak, instead he is writing love letters to Zuck and OIC. If I was a minority I wouldnt care as much about a temple or whether foreigners can visit their shrines in Pakistan. I would however care that nobody is calling my prophet a liar and that my daughters arent being kidnapped and raped while the judges get fat from bribes.


> Maybe we should be like France, if you see a woman in an abaya then the police should be allowed to put a gun to her head and strip her naked for muh republic.

No you are right, We should remain as we are. Where children get kidnapped and raped by men more then 3 times their age while the judges rule in favor of the rapist. Its almost like there is a middle road between the two cases. Which is where we should strive to be. But whenever anyone gives justified criticism, people like you show up acting like all is good in Pakistan because muh katarpur.

Idk why you think Im for France when all I said was that Pakistan doesnt treat its minorities right. Which is an objective truth. I dont care about France nearly as much as I care about Pakistan. Nor do I live in France so its matters dont affect me as much.",5,2,1604058641.0
gaksofa,t1_gajqht4,The first step to solving a problem is actually acknowledging that we have a problem. Yaha is step as jab agay nikal ai toh agla step ka socha ga.,5,1,1604039683.0
gaindr4,t1_gaimk0x,"What do you mean they don’t believe in towheed? I’m just looking to understand I’m not saying you are wrong. 
To me it’s always been belief in Allah is the one god  and the Quran",5,0,1603996081.0
gajus3e,t1_gajua9t,"Lol Pakistan allows dual citizenship, so yes, you can be American and Pakistani at the same time. If you have a problem with that, get the laws changed.

You didn't explicitly support any of it, but you told him to stfu because his tax dollars are used to kill people while ignoring how pakistan used your tax money to do and is still doing the same. That's the literal definition of hypocrisy. OP isn't saying we should call out atrocities in other countries, he's saying we have no right to call atrocities before we fix our own, read the post.

Whats wrong with nationalism is that you ignore the negatives in the country, as you are doing all over this post. Patriotism is when you want the best for your country.",5,4,1604017253.0
gajs5ej,t1_gajrxxo,"Achaa matlab ab nationality laws bhi apni peeche se nikalrahe ho? Kaha likha hai aisa, hame bhi to dikhao. Tumhare papa ka nai hai mulk ke jo reddit par aakar boldiya wo hogaya.",5,2,1604015807.0
gaibvow,t1_gaibfbo,if you mention the word liberal in front if him his alarms go off.,5,5,1603991470.0
gaibz92,t1_gaibfbo,Yeah I looked into his comment history and It was baffling but not surprising. Many people on this sub have a similar point of view who believe 18th amendment is the worst thing to exist in pakistan lol,5,1,1603991514.0
gaicbel,t1_gaibfbo,"Hey all I’m trying to do here is to help u normalize condemnation of PPP on a matter that falls right under their governance. This should not be a shocking or an outrageous thing to do, but the way you guys are going after everyone else except the responsible party gives me an insight in to how most of you are ideological drones, unable to think critically and unable to examine veracity of your own views. Blind bhakti should be left to the Indians and the zealots",5,-1,1603991655.0
gaiqtu9,t1_gaip4v5,Read the other guys comment. If you dont know you probably dont live in pakistan.,5,5,1603997478.0
gaovx4r,t1_gaotv9n,"Why are you bitching here about us then? This is the internet, we can say whatever we want here. We use it to highlight issues that are sometimes not covered or ignored by some Pakistanis. 

If my comment, or this post is offending you so much, then ignore it. No one is forcing you to post or even look at this.",5,3,1604145097.0
gn2i5h6,t1_gn1mhu2,"So, for all of those sources, I only found them in relation to TRT (state owned media by the Turkish gov). Hell, for the last one, I couldn’t even find the person themselves. Basically, any lack of corroborated evidence for any of these except for the one on the children. 

I did find this though when double-checking: https://www.google.com/amp/s/www.nytimes.com/2020/11/23/world/europe/france-extremism-children.amp.html

So I will concede that France is being shitty and racist in that regard, and I find that a blatant violation of human rights.

I will say, I don’t think this takes away from any arguments that Pakistan should be held to a similar standard when it treats its minorities like shit.",5,1,1613145286.0
galu8l0,t1_galiyra,"Aur toh aur, chai wala(Arshad Khan) bhee. Woh chai me aik chemical daltaa hai jis kee wajah se log Yahoodi ho rahay hain.",6,1,1604070522.0
gaklvnq,t1_gakjiq7,And I was challenging the notion that Anti-Semitic is exclusive to Jews and for some reason you really got butthurt over that.,6,1,1604033573.0
gajds1t,t1_gajcdnr,Ok Boomer!,6,-9,1604008207.0
gaiomyw,t1_gaioivl,"Get all the crazies out of here, trade them for the Uighurs in a heartbeat",6,3,1603996598.0
gajnt4k,t1_gajmiyb,[removed],6,0,1604013451.0
gajt5dm,t1_gajmiyb,Based take bhai,6,1,1604016354.0
gakyi7l,t1_gajmiyb,He straight up refused to declare OBL a terrorist in his interview with Waseem Badami. He played the usual one mans terrorist is another mans freedom fighter card.,6,1,1604046032.0
gaj4l4z,t1_gaj4c3g,:) 👍,6,2,1604003659.0
gaj9wy1,t1_gaj9op6,[deleted],6,2,1604006262.0
gak5wu8,t1_gaj9op6,"You are the nastiest fascist scum of the earth, not to mention you intentionally take verses out of context. You are truly one of the faces of pure evil.",6,2,1604023393.0
gajawrh,t1_gaj8i5w,">You have people in your religion interpreting those lines the same way I did and using it as an excuse to chop peoples heads off,

So basically you're saying you didn't read what I linked and don't intend to either? Cool. 

>but sure let's just pretend those lines don't mean what they say.

In the sentence, 'kill the poor rabid dogs'
You're basically taking out 'kill the poor' and condemning it.

>You being brainwashed all your life to believe in fairytales discredits any kind of logic you think you have,

According to whom exactly? 

You being brainwashed all your life by mere Internet posts discredits any logic you think you have here. 

>My interpretation is how most would read that, not some edgy take

Only a dumbass or someone looking to malign Islam would take that out of context. If you read the actual surah and not just a a specific line, you'd understand. But I forget, the entirety of your knowledge consists of the sentence ""Islam bad"" and a couple of misinformed posts on an Islamophobic sub or website.

>On top of that, I would need to have been brainwashed as a child as well for me to be an apostate. Luckily for me my parents didn't abuse me like that.
Basically you're saying that you're not gonna look into the thing you're condemning? Pretty bleak mindset you got there. It would be at least worth debating if you even had the slightest knowledge on anything you're talking about. 

>Luckily for me my parents didn't abuse me like that.
Unfortunately, your parents haven't seemed to have guided you in the slightest and have left you to find everything on your own. And instead of making educated decisions and condemnations, you decided, ""oh hey! I read islam bad, so islam bad!"" 


>It is a pity such a large amount of our population believes in fairytales

Like you'd know! How can you discredit something without even knowing what you're discrediting?

>you are correct

Yeah I know. Thanks for acknowledging it.

See how I took that sentence out of context and turned it agaisnt you? This is basically what dumbasses on the Internet do. And you're just copy pasting. Since, of course, your info comes from those misinformed random posts.

 I didn't come here to defend my religion, but it seems as if you've come here to attack mine.

If you're gonna be furiously typing down (copy pasting) another comment, I'll reply tomorrow. It's 2am.

 Au Revoir, edgy teen.",6,7,1604006762.0
gaisyvb,t1_gaisuqr,"I don’t support terrorist, I was referring to him going to court oh well",6,-7,1603998312.0
gairqfv,t1_gaipxsq,"It was the government that appointed him in the first place? It was the fazlu gang that started mass protests against the appointment, which led to a massive shutdown in the capital.

So is it our governments fault or the fault of those in opposition that are so desperate for power that they are willing to climb a pile of dead bodies in order to get there?

Do you consider Ahmadis muslim or non muslim?",6,4,1603997828.0
galcqpl,t1_galanei,"I've never disagreed so much with a statement. First of all Karachi is in Sindh, whether you like or not its under the PPP and their feudal dick stroking that all these fucked up cases come to pass. Give them an inch and they'll take a mile. When you have a province ruled by those that don't care, people will commit abuse.

Second of all this government has been on the ball with minorities. They appointed an ahmadi minister and the reaction by the opposition was to lay siege to the capital. Hardly the case that this government is hell bent on hurting religious sentiments of minorities.

If Judges are getting bribed than thats a law and order issue and should be dealt with on a provincial level. Personally haven't experienced this but I've lived in GB for most of my life.

It feels like you think we should just stay silent when our religion is attacked or when muslims are unfairly targeted. 

If you truly believe that the government isn't doing right by minorities then I cordially invite you to vote for the opposition who hate the fact that a temple is being built in Islamabad or that money was """"""wasted"""""" on Kartarpur.",6,1,1604060287.0
gakt54v,t1_gaksofa,Aaj kal ke ghazis ko ye kon samjhaye lekin,6,1,1604040153.0
gaiqkii,t1_gaindr4,Tawheed is believing in the first qalma which is there is only one god which is Allah and the prophet Muhammad ( s.a.w ) is his last messenger ( rasuul ). Ahmedis do not believe in the khutami nabeyeen of prophet Muhammad ( s.a.w ) being the final rasuul/prophet they believe mirza ghulam Ahmed as a prophet meaning they don't believe in tawheed which is one of the most important factors of being a Muslim.,6,-2,1603997378.0
gak1abt,t1_gajus3e,"laws don't define my opinion, my opinion and the majority of real pakistanis opinions are that you have to live in the country to be a Pakistani, you cant live somewhere else and then claim to be a representative of another place, how do you know op is not born in America like most of the retarded expats on this sub?

Pakistan has no ties to france so Pakistan can call out france, pakistan has ties to china and ksa so pakistan can not call them out. Simple

 nationalism is identification with one's own nation and support for its interests, especially to the exclusion or detriment of the interests of other nations.

If you arent a nationalist and support other countries over your own then gtfo.

Patriotism is short for contrarianism in this country, what you are doing",6,-3,1604020837.0
gajuinp,t1_gajs5ej,"logic, shahid tumhare baap ne tumhei sikhaiy nahi ho magar agar banda amreeka mein rehta hai woh pakistani nahi hota, mein kisi amreekan se apne mulk ki burayan nahi sunnon gan, agar tumhare paas inferiority complex ho to tum sun lo.s",6,4,1604017111.0
gaiq5qa,t1_gaicbel,"Have you ever cared to look at the statistics? For the last decade, Sindh has seen the least of violence against minorities than other provinces(or Punjab and KP.) I would encourage you to look at Pak Pips reports on it. Why would you cry mUh PPP on a thread like this?",6,4,1603997206.0
gaid3ld,t1_gaicbel,[deleted],6,-1,1603991986.0
