comment_id,comment_parent_id,comment_body,comment_depth,comment_score,comment_created_utc
gaizvzr,t3_jkbfl1,[deleted],0,113,1604001408.0
gai80ni,t3_jkbfl1,"Secularism is the work of the devil, but France and every other non-muslim country should adopt it. France should allow muslims complete freedom of religion, unless they're Ahmadis in which case they should be put in jail for reading the Quran and saying Asslamualikum. Countries should be more tolerant of others beliefs, but if you make even a slight comment about our religion you deserve to be killed. - average Pakistani's thought process",0,163,1603989688.0
gakwr8i,t3_jkbfl1,"Minorities? I belong to a shia family, Muslims but still we don’t feel safe here.",0,14,1604044056.0
gaia94t,t3_jkbfl1,I am sorry but reeks of hypocrisy in the Muslim world. ESP when they don’t condemn what’s happening in China.,0,91,1603990716.0
gai8yf1,t3_jkbfl1,"The point of the letters wasn't for protection of muslims in minority. It was to stop Islamophobic stances of governments and maligning all muslims. As provoking and condemning so many people creates enmity and leads to polarisation which, undoubtedly will lead to further radicalisation. Instead, condemn the roots of the problem. Welcome the muslims in open arms and fight polarisation which will ultimately lead to stopping radicalisation.",0,48,1603990119.0
gaj2a5c,t3_jkbfl1,"Besides, the more you tell people not to do something, i.e. draw harmless cartoons, the more they will want to do it.

You really want to stop Muhammad cartoons, just stfu and don't complain. When there is no reaction, there won't be a reason to draw them.",0,14,1604002557.0
gai6xs4,t3_jkbfl1,"Cool no one can criticise anyone then, just continue to spread your cheeks for the frogs 🥱",0,30,1603989188.0
gaicwz9,t3_jkbfl1,what a load of bullcrap in this comment section ffs. allowing minorities to construct their holysites dont mean they are treated equally too. open your damn eyes if you think that muslims in europe are treated much more poorly than the minorities in pakistan.,0,22,1603991907.0
gaj1fqa,t3_jkbfl1,"Plus, ""treating badly"" = hurting ma feelz.
Whereas extremist Muslims are retaliating by killing innocents.",0,9,1604002151.0
gai9tx3,t3_jkbfl1,The average Muslim here isn't safe here either.,0,11,1603990524.0
gajiypd,t3_jkbfl1,"Along with pakistan not giving a jack shit about China's treatment of muslims cause that tit is extremely fruitful. But oh no it's free speech, the horrors",0,4,1604010869.0
gai7x9t,t3_jkbfl1,"For the record, Pakistan gov't stance in treating minorities equally is fairly strong. They have demonstrated this through multiple events (i.e allowing construction of holy sites/temples, empowering/inclusion of minorities in politics). To be fair though, there is still a long way to go before the minorities are fully protected but regardless, the gov't is taking steps in the right direction.

France on the other hand hides it's institutional racism and double standards behind the veil of ""secularism"" and ""freedom of speech"". My family has lived there and eventually had to move out of the country due to increasing racism.",0,22,1603989644.0
gahuygp,t3_jkbfl1,"yes like we shouldnt take a stance on others killings of muslims too.We have to fix our own system too but not criticizng others on their wrong doings,then who will?you?fuck off.",0,13,1603983516.0
gaj5g08,t3_jkbfl1,[removed],0,2,1604004073.0
gai9j90,t3_jkbfl1,"shush! we don't talk about that here. 

White in our flag stands for minorities. ugh hat else do they want from us?!",0,5,1603990388.0
gaikbq9,t3_jkbfl1,Okay but with that logic liberal Pakistanis will cry about looking how at how the west treats its minorities. Now if secular countries cannot treat its minorities correct yet you stay silent about islamaphobia but bark against Pakistan a developing nation treating its minorities doesn’t that make you a hypocrite as well.,0,7,1603994842.0
gajbati,t3_jkbfl1,"Folks, the equation is simple:

If you mock someone's religious belief or belittle their object of devotion, then you are an asshole.",0,2,1604006958.0
gai429d,t3_jkbfl1,TFW house slaves come running to defend their goray masters 🤡,0,7,1603987855.0
gaipn28,t3_jkbfl1,take my poor man's gold award 🥇,0,3,1603996995.0
gahx4th,t3_jkbfl1,No minorities in Pakistan are not violated by the government,0,-1,1603984581.0
gaj6my4,t3_jkbfl1,"I don't think the government mistreats minorites, but rather the (uneducated) people. Unlike France, whose President promotes hatred.",0,1,1604004649.0
gai8h3a,t3_jkbfl1,Please learn to differentiate between a STATE that treats minorities badly (like India) vs a country where PEOPLE (not the govt) treats minorities badly due to deranged religious beliefs (like Pakistan).,0,-3,1603989897.0
gaiwlnt,t3_jkbfl1,is this r/pakistan or r/IndiaSpeaks,0,-1,1603999859.0
gaihkm3,t3_jkbfl1,It's not wrong as long as *Immy-chan* does it.,0,1,1603993740.0
gaig0v5,t3_jkbfl1,[deleted],0,-5,1603993133.0
gaildwv,t3_jkbfl1,HAHAHAHA OMG DUDE loved it!!,0,1,1603995277.0
gaj9ej9,t3_jkbfl1,"your gotta admit, his passing and time in that message was great. he sounded reasonable and... convincing, y'know, like a leader? can't say the same for previous Pakistani leadership, or even other current Muslim leaders either tbh",0,1,1604006008.0
gahv8vc,t3_jkbfl1,"Dick move mate, you had to use a picture of Jesus :|",0,-3,1603983660.0
gaiucg3,t3_jkbfl1,Yet another post filled with whataboutism .. I mean the world libtard does justice to the fact that these people are self loathing libtards ..,0,0,1603998861.0
gajwm61,t3_jkbfl1,You can't seriously accuse IK of being anti-minority. I wonder how many upvotes are coming from butthurt Patwaris with their supreme leader only known for defending Qeema Daal abroad.,0,-1,1604018272.0
gaktdqy,t3_jkbfl1,My God this has become like a hate sub for pakistan,0,-1,1604040401.0
gairecm,t3_jkbfl1,[removed],0,-8,1603997697.0
gaiwdt3,t3_jkbfl1,This Pakistani reddit is predominantly anti Pakistan. Situation for Pakistani minorities is much much better then other countries in the region.,0,-7,1603999758.0
gaiuiak,t3_jkbfl1,"We need China too much. Can’t risk livelihoods of our poor by calling them out openly. 
Our minorities need to be given their rights, but we have an uphill battle. IK gov is doing what needs to be done to move toward a progressive and fair society. Like economic issues, this sort of societal regression can’t be undone overnight. 
Countries like France claim to be fair, just societies and they also aren’t crippled by economic issues. They should and can do better and it is no hypocrisy to say so. It would be hypocrisy is Pak gov was doing nothing to fix the shitty state of the country.",0,0,1603998926.0
gaioe9w,t3_jkbfl1,I don’t even believe people who post this cray are Pakistanis this has gota be an Indian troll,0,-6,1603996496.0
gakqhuu,t3_jkbfl1,"Pakistan has done enough damage to us Muslims world wide. Pakistan/Pakistanis are not in anyway the representatives of our beautiful religion. 

They(entire Pakistan) doesn’t everything against our religion and the teachings of our beloved Prophet. So I would urge the Pakistani’s who are in other countries to shut it especially while talking about Kashmir matter and make life hell for us Muslims in India.",0,-2,1604037550.0
gais722,t3_jkbfl1,"So are we throwing minorities in jail for feeling offended when someone actively offends them?

You degenerate liberals.",0,-7,1603998005.0
gaj4thv,t3_jkbfl1,Umm 😐idk what to say.......like......🙄never mind,0,-1,1604003772.0
gaijjyi,t3_jkbfl1,[deleted],0,-5,1603994524.0
gakss3z,t3_jkbfl1,[removed],0,1,1604039785.0
gduqyxc,t3_jkbfl1,"This is BULLSHIT, part of Indian propaganda...",0,1,1606557295.0
gfnd9x2,t3_jkbfl1,Those is true in case of My India..,0,1,1607837341.0
gajr82z,t1_gaizvzr,[deleted],1,15,1604015299.0
gal0xsk,t1_gaizvzr,"Well i studied at BVS (lancelot for life). Its one the best school for boys in PAK. I used to love visiting KPI as many sports functions were held there. Last time i visted KPI it didnt look in good condition. Hopefully it is now. 

You guys have a very rich culture, i hope we get more harmonious!

P.s: Love to all the Parsis, especially to Ms Deena Mistri  (the greatest educator ever)",1,3,1604048796.0
gajhiqw,t1_gaizvzr,Wait. How is eating ham disrespectful?,1,1,1604010116.0
gajl2oy,t1_gai80ni,">orite scape-goat label is yahoodi agent/zionist. IDK why every time someone calls me that I feel invincible and on top of the world.

I have had discussions with Pakistanis here who live in the west and hate secularism for Pakistan.   


Funny enough... they have no problems with it in the west.",1,31,1604011991.0
gailgx0,t1_gai80ni,This is spot on accurate with nth decimal precision. I have met a shit ton of people who think like that. Actually the majority think like that. I even know a PHD(family friend) that think like that. I have lost all faith in this country(no pun intended).,1,43,1603995310.0
gakcth5,t1_gai80ni,had me at the first half ngl,1,6,1604027318.0
gaj62r7,t1_gai80ni,This is so accurate it hurts.,1,10,1604004378.0
gairk02,t1_gai80ni,[removed],1,-15,1603997758.0
galqn51,t1_gai80ni,"As i started reading this, i got a bit mad at how this guy has 100+ upvotes. 

So would you say that the current and past governments are to be blamed for this thought process of the average citizen? Education opens your mind to new ideas and all but we all know that having a good education is only possible for the privileged in  pakistan.",1,1,1604068681.0
galx2ft,t1_gai80ni,I looked at the upvotes and went yikes until I read the last part,1,1,1604071930.0
hi6yagr,t1_gakwr8i,"Still minority 

Since most muslims wont accept it",1,1,1635298411.0
gaidrpt,t1_gaia94t,"According to IK's govt nothing wrong is happening in china. But this sub isn't ready to have this conversation ;)

edit: source: https://thecurrent.pk/imrans-national-security-aide-terms-chinese-persecution-of-muslims-a-non-issue/

> “Uyghurs is a non-issue […] Our delegations have visited, we’ve seen and we are a 100 per cent satisfied that it’s a non-issue. The West can say what it wants. I am telling you as a responsible official: we know everything we need to know about the Uighurs and everything else in China as they do about us.”",1,41,1603992266.0
gajgdwz,t1_gaia94t,"Unfortunately pakistan was trapped in a financial and economic lock by nawaz sharif, when they signed their CPEC deal. As most people know, he's in jail and he was a disgrace to pakistan, unfortunately, details of that deal weren't released to the public much at all, and in such a gigantic trade deal that makes China and Pakistan undoubtable allies, its impossible for future governments to oppose China, and Pakistan needs them for their survival because economically, Pakistan is in shambles after the huge corruption by previous governments, and struggles to pay back debts and have any sort of well-functioning welfare system because of this. If China withdrew support now, because Pakistan opposed them, the consequences would be catastrophic. Pakistan would slowly descend into an economic collapse as all of the investments in places such as Gwadar and all the infrastructure would come to a halt, and the loans China has given to Pakistan will probably be demanded back, and Pakistan would be left to collapse. It was a deal done by nawaaz sharif, that was probably not as good for Pakistan as it couldve been and probably shouldnt have even happened if he, or other corrupt runners, weren't in power. 


TLDR: Pakistan is trapped in trade deals and economic deals by China and the country will eventually crumble away as Pakistan ended up building too much dependency on China by making these deals, it would be near impossible to survive.",1,12,1604009530.0
gaj80ej,t1_gaia94t,"Someone else who lives in the US and pays taxes that powers the worlds biggest war machine that has killed millions of innocent Muslims in the Middle East and Pakistan over the last few decades discrediting brown people for being upset at a colonial power disparaging Islam as a whole. 

I agree Muslims can be hypocrites but you are being a very vulgar orientalist.

Please stop this whataboutism anytime the brown and blacks criticize Anglo countries. They will not see you as one of the good ones.",1,19,1604005316.0
gaif4um,t1_gaia94t,Whataboutism,1,-3,1603992797.0
gaiiz3n,t1_gai8yf1,"Then maybe a leader of an Islamic nation should express sympathy for a country plagued by heinous acts committed in the name of a hijacked ""Islam."" Those murderers are doing far more damage to the religion than France's actions. Where's IK's letter to the Islamic fundamentalists who think it's okay to kill rampantly?",1,26,1603994294.0
gaic3ud,t1_gai8yf1,[deleted],1,3,1603991566.0
gaitfq6,t1_gai8yf1,[removed],1,-2,1603998499.0
gaj5n3z,t1_gai8yf1,"I feel it makes sense for only leaders of free people to take moral positions on freedom, inclusion, progressive values etc. It's a joke when leaders who are constantly trying to undermine citizen's rights attempt it. I don't think any of the South Asian leaders qualifiy.",1,-1,1604004169.0
gajevh7,t1_gaj2a5c,"Or itll just let all the other, innocent teachers think that doing it was okay and that what happened was that a crazy terrorist attacked them and that islam allows cartoons of prophets. Your thought process is flawed. Yes, the people who are doing it to provoke reactions will do it less, but people who dont know that muslims do not like this and it is very offensive to their religion to do that will draw them because they don't know. The reason to draw them is very normal - to show people a cartoon for eductation, not to harm. That is very common in Religious Studies, and letting the teachers know that it is offensive to muslims will educate them, just how people should respect all orientations, beliefs and faiths, we would ask that our beliefs are respected too.",1,-3,1604008760.0
gaieyb0,t1_gai6xs4,"r/pakistan in a nutshell, whataboutism and being ""woke"".",1,23,1603992723.0
gaikad0,t1_gai6xs4,[deleted],1,17,1603994826.0
gajclq3,t1_gai6xs4,"I think the point is that if Pakistan is lodging criticism, then Pakistan should also use some basic introspection and see how they can improve their own treatment towards minorities. It’s really that easy. They can criticize France but they should also then address the asinine ways minorities get treated here. If Pakistan can’t do that, then why should it lodge criticism? People can have opinions but they shouldn’t be hypocrites.",1,5,1604007613.0
gainse6,t1_gaicwz9,"How is ""the government treats minorities in Pakistan well"" even a remotely true statement, I am baffled. They're claiming the bad stuff is all done by individuals and not state sanctioned, but that statement rings hollow when the government typically allows atrocities to be committed against minorities by letting away the criminals with nothing but a slap on the wrist. This makes the government complicit. Not even going to talk about Ahmadis and their state-sanctioned 'non-Muslimness'.

Just because some good (symbolic) steps are being taken by the govt, it does not make this statement true. This is the exact same mentality as ""how can I be racist if I have black friends""",1,21,1603996249.0
gaikk9s,t1_gai9tx3,"What you mean ? I'm a sunni punjabi male, i feel safe",1,11,1603994942.0
gaifb58,t1_gai9tx3,"Let them serve their western masters, it makes them feel special and intelligent.",1,-9,1603992866.0
gaie1e1,t1_gai7x9t,"Not really  I think everyone is forgetting how Pakistanis and the government treat Ahmadi muslims who are a minority group in Pakistan.

They get murdered and the murderer walks away with a slap on the wrist. I’m sick of the double standard. 
Personally in my family my cousins who were under 15 at the time would have rocks thrown at them because they were known to be ahmadis. They hung my uncles elderly neighbour because she was ahamadi. They burned my uncles work vans and bus. 

Don’t forget the world class American heart surgeon that was murdered in front of his family when he went to Pakistan to do some charity medical work. Dr Mehdi Ali Qamar",1,22,1603992373.0
gakuxlo,t1_gai7x9t,"As a Pak American, you also don't have the 1st amendment protectoin of free speech like you do in the US, in most of Europe.  


You can get arrested for anti semitism but not islamphobia (and yes people have been insulted for insulting jewish BELIEFS not just people)",1,3,1604042051.0
gaidnlu,t1_gai7x9t,There's not much a government can do except educate people when the society itself is so vehemently intolerant.,1,5,1603992221.0
gaigkb2,t1_gai7x9t,"This won't solve any issues.  
If I commit crime against minority I will go to jail, if you commit crime against minority you will got to jai.  
You know who does not got to jail? People in power.   

Sadly by law minority can't be given any political power.  
This is exactly why minority problem can not be solved.  
  
USA majority white people are fightings for black minority and because they have equal rights and have a chance to be in power too.",1,3,1603993339.0
gaiaxtm,t1_gai7x9t,This is r/pakistan,1,-2,1603991034.0
gai3kuo,t1_gahuygp,"We should criticise others but we should also fix our issues. Our prime minister is not interested in doing the second part, which makes his stance hypocritical. He should at least acknowledge the issue here",1,7,1603987625.0
gahvxdi,t1_gahuygp,"hmm, why dont we ever stand up to china or ksa 😳😳😳",1,3,1603983995.0
gaj5g1r,t1_gaj5g08,"Your comment has been automatically removed because it has been determined as unfit for healthy discussion in /r/Pakistan. Please ensure that you have read and are well aware of [the rules](https://www.reddit.com/r/pakistan/wiki/rules) for /r/Pakistan.

*I am a bot, and this action was performed automatically. Please [contact the moderators of this subreddit](/message/compose/?to=/r/pakistan) if you have any questions or concerns.*",1,1,1604004074.0
gaiz3y6,t1_gai9j90,Usi white part main danda dia jata hay xD,1,11,1604001043.0
gakr6co,t1_gaikbq9,"West mistreating its minorities: drawing cartoons.

Pakistan mistreating its minorities: killing them.

Can’t compare the two bruh.

Also, it’s the job of Western liberals to criticize Islamophobia, which they do. It’s the job of Pakistani liberals to criticize treatment of minorities in Pakistan, which they do. Why would a Pakistani liberal spend too much time criticizing Islamophobia in the US? He doesn’t get to vote in American elections. Har mulk ke liberals apne apne mumalik ki zyadtion ke khilaf baat karte kain.",1,13,1604038203.0
gaiw0n3,t1_gaikbq9,"Constructive criticism is not “bark against Pakistan”
Comparatively secular States are treating minorities a lot better than us. 
The hypocrisy is that you’re time deaf towards local or even Allie(Chinese) minorities. 
Then we have the audacity to call out others without fixing our own shit.",1,18,1603999588.0
gaioo16,t1_gai429d,"Will you take financial advice from a broke person?
If not, then why do you expect France to listen to a country with its own minority abuses?

Dusro ki panchayat karne se pehle apna ghar sudharna chahiye. Not everything is ""defending goray masters""",1,18,1603996611.0
gaifcy1,t1_gai429d,Thats what this entire sub is full of,1,2,1603992885.0
gal72hr,t1_gaipn28,🥺💓,1,2,1604055448.0
gajr1b4,t1_gahx4th,All the anti-Ahemdi laws were put on by the government and supported by the populace.,1,10,1604015197.0
gai3vf7,t1_gahx4th,Pls explain section 298b and 298c ppc,1,15,1603987766.0
gai3pxm,t1_gahx4th,Government turning a blind eye to the issue is not any better,1,4,1603987692.0
gaiad0q,t1_gahx4th,....yes they quite literally are? Wtf.,1,4,1603990767.0
gaiywro,t1_gai8h3a,"There is functionally no difference for the minority being treated badly. In time, both converge to the same end result, systematic discrimination. 

This is why, even after the end of slavery, and Civil Rights movements, the lives of Black americans are still orders of magnitude worse that those of whites. The system treats all races equally and even punishes discrimination, but the agents of that system just choose to overlook or enable the racism of a few people. 

State sponsored discrimination is equivalent to discrimination where the state doesn't sponsor discrimination, but chooses to ignore it all the same.",1,4,1604000952.0
gaic0ws,t1_gai8h3a,There are laws in place to punish minorities.,1,13,1603991532.0
gajdxnw,t1_gai8h3a,"Wrong is wrong, no excuses for that",1,3,1604008286.0
gajcsbz,t1_gaiwlnt,Pakistanis can criticize Pakistan. It’s not a difficult concept,1,15,1604007707.0
gaobnof,t1_gaiwlnt,I'm from India,1,1,1604122175.0
gajrm0w,t1_gaig0v5,So the extremely discriminatory and inhumane laws were put in place to save the Ahemdis? Wah janab. Heard tons of bad justification but tumhari ka toh level he alag ha.,1,9,1604015511.0
gaj7xdt,t1_gaig0v5,This has to be the most stupidest justification for state sanctioned discrimination.  Oh this group of people are getting killed and discriminated oh let the state do it so these people don't?  What type of banana republic would do such a thing.  Imagine if the American government was like oh black people are getting lynched let's put an end to it by doing the lynching ourselves through a court of law.  If they wanted to put an end to the violence they should've went after the instigators of the violence and health with them.  Minorities aren't oppressed by the government?  Which Pakistan do you live in?,1,14,1604005275.0
gaiksae,t1_gaig0v5,"Half of the people in this sub dont even live in Pakistan lol, save your breath bro",1,3,1603995036.0
gaimmfk,t1_gaig0v5,"Really? That's interesting. 

I always thought it was just a dick move by the government of the time that passed those laws.",1,-4,1603995778.0
gai7h5d,t1_gahv8vc,Yeah. And he's sitting with Jim Caviezel.,1,1,1603989438.0
gajedu4,t1_gairecm,"Nice hipocricy. Attacking a whole religion while trying to fight against attacking minorities. Many people like you love to say things about Islam without knowing the ideologies themselves. The ideology of islam absolutely denies what was done to the french teacher. You're the typical religion-hater who bases the whole religion off of the minorities, the terrorists. You are no better yourself",1,1,1604008512.0
gajnvt0,t1_gairecm,"hmmmmm i wonder why the ""secular"" world is the one causing the most damage and destruction to world, maybe they are the tru barbarians",1,1,1604013491.0
gajumri,t1_gairecm,"Yeah, majority of us *are* condemning him. I don't care what you think of Islam but just because we're muslim doesn't mean we like to behead anyone who offends us.",1,1,1604017173.0
gaiye3g,t1_gaiwdt3,"You're joking, right ?",1,8,1604000711.0
galo73z,t1_gaiwdt3,"Nice joke. You must come from the ""majority"" community to say that nonsense.",1,3,1604067384.0
gairnh8,t1_gaioe9w,"How dare someone oppose my views on politics, this has to be a Indian troll",1,13,1603997796.0
gaj8dlo,t1_gais722,Yes we are.  Did you not here about the case of Ahmadis who were arrested for removing posters that had offensive things written about them.  They were then charged with blasphemy.  One was shot during a court session.  How is that any different to what's happening on France.  We literally did the same thing but that probably doesn't fit with your agenda of Pakistan the greatest in the world.,1,9,1604005498.0
gajdewq,t1_gais722,Is France throwing Muslims in jail for being offended? Because I’m pretty sure the guys going to prison are those that have assaulted or killed lmao.,1,3,1604008023.0
gaimaom,t1_gaijjyi,Oppressed people in Indian occupied Kashmir do the same to protest Indian brutalities in Kashmir. Going by your logic they are not treated badly either?,1,5,1603995645.0
gakss4r,t1_gakss3z,"Your comment has been automatically removed because it has been determined as unfit for healthy discussion in /r/Pakistan. Please ensure that you have read and are well aware of [the rules](https://www.reddit.com/r/pakistan/wiki/rules) for /r/Pakistan.

*I am a bot, and this action was performed automatically. Please [contact the moderators of this subreddit](/message/compose/?to=/r/pakistan) if you have any questions or concerns.*",1,1,1604039785.0
gajsvtu,t1_gajr82z,[deleted],2,36,1604016211.0
gajhogg,t1_gajhiqw,[deleted],2,16,1604010199.0
gajhphl,t1_gajhiqw,Huh,2,1,1604010215.0
galtyg6,t1_gajl2oy,"I have never been outside of Pakistan, but I dream of settling down in some western country in the future. I am already nervous about my safety. Some Pakistani living abroad are even more extremists then those that live over here.",2,6,1604070380.0
ganh5ky,t1_gajl2oy,Sounds like Modi Bhakts who live in USA. Supports liberalism in West but wants BJP govt in India lol.,2,1,1604101231.0
gairxsu,t1_gailgx0,Bruh you’re definitely a Indian troll Yahoodi Agent sent by the US funded by CIA. I don’t think a /s is needed,2,23,1603997906.0
gajl6jg,t1_gairk02,Arabs are the biggest sematic group so how can the Quran be anti Semetic?,2,3,1604012047.0
gaipr1y,t1_gaidrpt,the entire country isn't ready to have this conversation. Neither is the black Vigo outside your door.,2,21,1603997040.0
gaii2ua,t1_gaidrpt,What do u mean? When does this sub not talk about China's treatment and when does it not get highlighted?,2,18,1603993949.0
gaie4qv,t1_gaidrpt,Exactly.,2,2,1603992409.0
gaiexed,t1_gaidrpt,"Because hazaras are considered as third class citizens, and Uighurs look similar to hazaras. That's why.",2,0,1603992713.0
