comment_id,comment_parent_id,comment_body,comment_depth,comment_score,comment_created_utc
gn2i6jo,t1_gn2i5h6,"It looks like you shared an AMP link. These should load faster, but Google's AMP is controversial because of [concerns over privacy and the Open Web](https://www.reddit.com/r/AmputatorBot/comments/ehrq3z/why_did_i_build_amputatorbot). Fully cached AMP pages (like the one you shared), are [especially problematic](https://www.reddit.com/r/AmputatorBot/comments/ehrq3z/why_did_i_build_amputatorbot).

You might want to visit **the canonical page** instead: **[https://www.nytimes.com/2020/11/23/world/europe/france-extremism-children.html](https://www.nytimes.com/2020/11/23/world/europe/france-extremism-children.html)**

*****

 ^(I'm a bot | )[^(Why & About)](https://www.reddit.com/r/AmputatorBot/comments/ehrq3z/why_did_i_build_amputatorbot)^( | )[^(Summon me with u/AmputatorBot)](https://www.reddit.com/r/AmputatorBot/comments/cchly3/you_can_now_summon_amputatorbot/)",6,1,1613145300.0
gn6mo95,t1_gn2i5h6,"And I ask you. When has Pakistan arrested children of minorities just for voicing political opinions?

*If* Pakistan treats its minorities like shit, then yes it should stop. But it does not. Minorities have reserved seats in parliament and a quota in government jobs **greater** then their share in population. Please tell me of any western government having this.

Where minorities are harmed, it’s not due to the state. And minorities getting harmed by people happens all over the world (which does not make it okay) in states far stronger than Pakistan. Just look at all the knife attacks on Muslims in France and stuff like that. And they aren’t things being done by some group having links to foreign intelligence agencies and black water like TTP.

\[Though in my opinion Musharrafs actions were (indirectly) greatly responsible for creation of TTP.\]",6,1,1613213037.0
gam0mvx,t1_galu8l0,#Boycott ArshadKhan ChaiWala,7,1,1604073689.0
gam99m6,t1_gaklvnq,"I already knew but the guy(the one saying that Arabs can’t be anti Semitic) didn’t know about the Jew meaning, and and made his wrong point and I pointed it out.

There was no need for you correction and you missed where I literally said” Semitic is used for Arabs”.",7,1,1604077908.0
gaip6z1,t1_gaiomyw,"Ofcourse we would, their HDI is still far higher than us & they are trying to keep it that way to not turn out as our unfortunate situation.",7,2,1603996825.0
gajohms,t1_gajnt4k,[removed],7,-1,1604013815.0
gal6vnm,t1_gakyi7l,"he never refused to call him terrorist, and he is right, one mans terrorist is another mans freedom fighter, OBL's atrocities were jacks shit compared to major world power",7,-1,1604055263.0
gaitg4l,t1_gaisyvb,"Bullshit.

In what way does referring to someone going to court turn to not letting someone go and making an example of them?

In any case there are plenty of other comments of yours from that post which show you blatantly supporting the terrorist.",7,7,1603998504.0
gaiuqjs,t1_gairqfv,[removed],7,11,1603999016.0
galfjj8,t1_galcqpl,"

> When you have a province ruled by those that don't care, people will commit abuse.

Again. As I said. Its not just Sindh. Things like that happen in Punjab aswell. Theres also the bachabazi culture (which is not against minority but its still abuse) in KPK. Theres the tribal laws in Balochistan (which are hell for the women there) aswell. No province in Pakistan is free from absolute savagery. So stop trying to make this a Sindh issue and acting like all is good everywhere else when this is quite clearly a Pakistan issue. What have other parties done to stop the issues I mentioned in their provinces.

 
> Hardly the case that this government is hell bent on hurting religious sentiments of minorities.

As I have said. I dont think that this government is against minorities. I mean there are MNA members from PTI like Ali Muhammad Khan and Noorul Haq Qadri, who have made it their lifes mission to demonise Ahmedis. But I do agree that IK, Asad, Fawad and Shireen Mazari atleast care about minority rights. But as I said. They are in power now. They could have tried to force their way through. In Pakistan oppositions have always tried to make life hell for the sitting govt. IK did it too. Which is his right. But does that mean that you fold your arms and start acting impotent whenever you meet resistance.


> It feels like you think we should just stay silent when our religion is attacked or when muslims are unfairly targeted.

I didnt say that. Tell me where I said that. I just said that you shouldnt press the 'X' button whenever you face justified criticism. We live in Pakistan, we are responsible for protecting minorities. But IK recently has been going all out with his letters. Did he comment on the Arzoo case. Has he done anything for Ahmedi rights since he has been in office. I mean he can say all he wants about how muslim sentiments are hurt. And thats ok, cuz muslims do have a right to feel hurt. But what about the hurt sentiments of Ahmedis when people call their prophet fake or liar. IK is the only one who can do something about that. The fact that he would rather care about foreign issues rather than solving issues back home just shows that he doesnt care as much as he would like us to think.


The last couple laws that were passed by the govt had to do with adding khatam-e-nabuwat after Prophets name and not drawing prophets caricatures. Tell me which dumbass in Pakistan is brave enough to draw a caricature. Tell me is that what the govt should be prioritizing. Obviously no. But these are the only bills being brought forward and the only bills being passed.

> If you truly believe that the government isn't doing right by minorities then I cordially invite you to vote for the opposition who hate the fact that a temple is being built in Islamabad or that money was """"""wasted"""""" on Kartarpur.


Just because I criticize IK. Doesnt mean I support opposition. The opposition in Pakistan are utter trash. And anybody who votes for them needs a lobotomy. But that doesnt mean that I cant say that the current govt isnt doing enough when it could be. Im not a nationalist nor do I have party loyalty, though I am a patriot who wants change in pakistan and for that I do have the right to criticize the person I voted for. (I forced myself to vote for amir liaquat for fucks sake)",7,3,1604062261.0
gak1vg5,t1_gak1abt,"Well, sadly for you your opinion or anyone else's opinion is insignificant and doesn't matter at all in front of the the country's law. An American can be a Pakistani and there isn't anything you or any other self-proclaimed ""nationalist"" can do about it, unless the law is changed. You don't have the authority to define who is or isn't a Pakistani, you don't have that clout no matter how much you claim it.

Uhhh, America also has ties to Pakistan, so an American should be able to call out Pakistan by your own logic.

Lol, stfu my guy, your ""nationalist"" Pakistan lumber 1 mentality is why we are in this mess. You have to accept the negatives if you want to improve.

Patriotism is patriotism. Your ""nationalism"" is fascism, what you are doing.",7,3,1604021158.0
gajv7nb,t1_gajuinp,"Kisi ka baap kuch bhi bole, usse pakistan ka dual citizenship law ko koi farq naii parta. Ek admi ek waqt me American/Pakistani dono hosakta hai, according to the law. Tum ya tumhare jaise baaki ""nationalists"" jo bhi bole, uski mulk ke law ke saamne koi auqaat nai hai, so don't talk about facts if you don't understand it. Tumhara baap aisa sochta hoga lekin use sochne se haqeeqat nai badalti. Itni hi jal rahi hai agar to law change karo jaake. Tumhare reddit pe apne dimaghi futoor ugalne se kisi ko ghanta farq nai parta.

Pakistan me baith kar sab bahar ki burayi karlo, lekin agar bahar se koi Pakistan ki burayi kare to aag lagjati hai, ye hypocrisy nai hai?",7,1,1604017491.0
gaiw1br,t1_gaiq5qa,"And yet it remains In this most recent case, PPP has chosen to look the other way. I’ve read those respondent surveys, are those the ones u talking about 🤔

Send link",7,2,1603999597.0
gaidelt,t1_gaid3ld,Still can’t question them with out keeping sarcasm at bay. I don’t blame you tbh.,7,3,1603992116.0
gam0pe8,t1_gam0mvx,Done.,8,1,1604073722.0
gajorlk,t1_gajohms,"Lol no I'm not a ""bhutto simp"", Fuck Bhutto/Zardari/Bilawal, Fuck PPP. But also, Fuck PMLN/PTI/MQM/JUI/whatever other party there is. Sab politicians nali ke keeray hain, your IK is no different from them. Where did IK say that he was made a shaheed like Bhutto? He didn't mention Bhutto there at all.",8,-2,1604013963.0
gal8dzn,t1_gal6vnm,"https://twitter.com/Razarumi/status/735336652609064961?s=20


Here he did. Even when Waseem asked the question again to clarify he straight up refused to comment.


You can say what you want. But theres video proof.",8,2,1604056688.0
ganzdhz,t1_gal6vnm,"Lool ok, so you're fine with OBL using the banner of Islam to commit atrocities? Lol what a fool. What happened to ""If you take one innocent life, it is as if you killed all humanity""? Hamare nabi se zyada jaanta hai tu? Ek to Islam ki aar me begunaho ko katal kiya upar se freedom fighter aur shaheed bhi hogaya, wah bhai, salam tumhari soch ko.",8,1,1604112658.0
gaiu57f,t1_gaitg4l,"Even if i did so, and honestly i vaguely remember then i have changed my views, is it wrong or impossible to do so? Fuck off you freak and get off my feed",8,-3,1603998781.0
gaiv1dn,t1_gaiuqjs,Hard to find a vigo that runs on diesel 😔,8,6,1603999135.0
gakv2dt,t1_gak1vg5,"Retard moment, holy shit this country is done for if everybody has an iq like yours. Just because the country is so poor that it has to accept medieval laws like dual citizenship doesn't mean i have to accept it, just like French people don't accept muslims as french i don't accept an American as Pakistan and the majority of Pakistanis don't, which. A Pakistani is someone who lives in Pakistan, you cant be born in America and be Pakistani, that's not even how dual citizenship works retard. Just because you are ostracised by Americans doesn't mean you can't come and try to find a sense of community with Pakistanis with your complete cultural disconnect, you inability to speak the language and disgusting attempts to destroy and butcher it.

Well, America has done far far far more than Pakistan so maybe this American should heed your own advice and look at their own country before criticizing others?

identification with one's own nation and support for its interests, especially to the exclusion or detriment of the interests of other nations.

THE DEFINITION OF NATIONALISM

If you prioritize other nations on top of mine than GTFO of my country, that is if you even live in my country lmao.

Oh wow I'm so shocked you look at Pakistani problems through the lens of your white masters, i wonder why i don't want people like you commenting on things you don't know jack shit about?

When have i hated a minority group? How am i fascist? Seems to me you just hate people who love Pakistanis. Maybe you are the real fascist? No nation can exist without nationalism, especially not Pakistan, nationalism is supporting your country over others, that's it",8,1,1604042196.0
gaksfs8,t1_gaiw1br,">I’ve read those respondent surveys, are those the ones u talking about 

Nope. These reports are based of reported no of violence cases against minorities.  There's a section on violence against minorities in their yearly security reports.(https://www.pakpips.com/) You get to hear a lot about Sindh because there are people who speak in support of minorities(mostly Sindhi Hindus) whenever something like that happens, due to Sindhi nationalism. Just look at the famous Reena and Raveena's case, [they were popularised as forced conversions and it turned out they weren't forced.](https://tribune.com.pk/story/2235763/1-hindu-sisters-married-muslim-men-reconcile-families).",8,2,1604039439.0
gal975r,t1_gal8dzn,What's wrong about his statement?,9,1,1604057406.0
gaiunco,t1_gaiu57f,Oh no the terrorist sympathiser feels bad about getting called out on his views.,9,6,1603998980.0
ganyrjh,t1_gakv2dt,[removed],9,1,1604112254.0
gamwskd,t1_gaksfs8,That’s the link to the website. I’m looking for the link to the specific study that u mentioned,9,1,1604089752.0
galaxo9,t1_gal975r,"Did you listen to it?

He straight up refused to call OBL a terrorist when Waseem Badami asked him whether IK thought OBL was a terrorist. It shouldnt be hard to call a guy that was responsible for thousands of innocent deaths a terrorist. But instead he went the freedom fighter route.


Do you agree that OBL is a terrorist or not? If yes, then thats what is wrong with his statement.",1,2,1604058875.0
gaivfh4,t1_gaiunco,"I’m not a terrorist sympathizer, please fuck off",1,-2,1603999313.0
gaivgrq,t1_gaiunco,[removed],1,1,1603999330.0
ganyrks,t1_ganyrjh,"Your comment has been automatically removed because it has been determined as unfit for healthy discussion in /r/Pakistan. Please ensure that you have read and are well aware of [the rules](https://www.reddit.com/r/pakistan/wiki/rules) for /r/Pakistan.

*I am a bot, and this action was performed automatically. Please [contact the moderators of this subreddit](/message/compose/?to=/r/pakistan) if you have any questions or concerns.*",1,1,1604112255.0
ganreft,t1_gamwskd,"Ab kiya step by step guide karoon? Goto to the download section and they have yearly security reports. It included violence against minorites, check every year's report and see that Sindh has least of it when compared to Punjab and KP.",1,1,1604107494.0
gaiyxwg,t1_gaivfh4,"Damn! You have no shame, not even an iota of it. After being called out, clearly shown the proof that you supported that murderous maniac Khalid and justified killing of a troubled person stating he was going to infect others, you are now hurling abuses at others who dare show you what you really are; a terrorist sympathiser. Don't deny, your statements are out there, you are an extremist and a bigot we get it, at least have the decency of not lying to people's faces about your beliefs.",2,4,1604000966.0
gaivgtu,t1_gaivgrq,"Your comment has been automatically removed because it has been determined as unfit for healthy discussion in /r/Pakistan. Please conduct yourself in a mature and productive manner. Ad hominem attacks are strictly forbidden. Any cheap language and uncivil behaviour may be dealt with strictly. Please ensure that you have read and are well aware of [the rules](https://www.reddit.com/r/pakistan/wiki/rules) for /r/Pakistan. If you feel you received this message in error, please feel free to [contact the moderators](http://www.reddit.com/message/compose?to=/r/Pakistan&subject=AutoMod%20inappropriate%20comment%20removal%20appeal&message=Dear%20Mods%20of%20%2Fr%2FPakistan%2C%0A%0AHello!%20I%20believe%20that%20my%20comment%2C%20https://www.reddit.com/r/pakistan/comments/jkbfl1/oop/gaivgrq/?context=3%20was%20removed%20in%20error%20and%20would%20like%20to%20appeal%20it%27s%20removal%20because%20...) and appeal this removal.

*I am a bot, and this action was performed automatically. Please [contact the moderators of this subreddit](/message/compose/?to=/r/pakistan) if you have any questions or concerns.*",2,1,1603999331.0
gansj8m,t1_ganreft,"> Ab kiya step by step guide karoon? Goto to the download section and they have yearly security reports. It included violence against minorites, check every year's report and see that Sindh has least of it when compared to Punjab and KP.

Sorry yaar, because I’m seeing them reports and Sindh is over represented in violence against minorities compared to other provinces. PPP gov is destroying the minorities of Sindh. It’s the Sindhi Hindus who are having to flee to the India after all",2,1,1604108211.0
gaj3938,t1_gaiyxwg,[removed],3,1,1604003021.0
gansoc0,t1_gansj8m,">Sorry yaar, because I’m seeing them reports and Sindh is over represented in violence against minorities compared to other provinces. PPP gov is destroying the minorities of Sindh. It’s the Sindhi Hindus who are having to flee to the India after all.

Which year's report did you see?",3,1,1604108300.0
gaj3950,t1_gaj3938,"Your comment has been automatically removed because it has been determined as unfit for healthy discussion in /r/Pakistan. Please ensure that you have read and are well aware of [the rules](https://www.reddit.com/r/pakistan/wiki/rules) for /r/Pakistan.

*I am a bot, and this action was performed automatically. Please [contact the moderators of this subreddit](/message/compose/?to=/r/pakistan) if you have any questions or concerns.*",4,3,1604003021.0
gant0mc,t1_gansoc0,"Many of em, the ones that you spoke about",4,1,1604108518.0
gant7ce,t1_gant0mc,"LOL, abhi aik pehle toh tumhen pataa nahi thaa k reports hai kahaan par, abhi poore 10 saal ki reports parh bhi leen aur incidents count bhi kar liye. Jhoot bolne ki bhi hadd hoti hai.",5,1,1604108636.0
gantlso,t1_gant7ce,Read em yourself tbh. Jhoot tumhain bolnay ki Adat hai.,6,2,1604108891.0
ganu0ve,t1_gantlso,"I have read it and anyone reading the comments can read them. Most years don't even have Sindh on it, like 2017m where most of these cases were from Punjab.",7,1,1604109160.0
ganu8q4,t1_ganu0ve,I’ve read em too and you are categorically incorrect about the reports; Atleast on the last 10 years,8,2,1604109298.0
ganutyn,t1_ganu8q4,"Jo banda mu pe jhoot bole ab usko kiya karsakte hain. Anyways, I might visualise the data with graph and post it here next week. Tab tak jhoot kaa hi sahara len aap.",9,1,1604109675.0
gao1pwp,t1_ganutyn,Be sure to provide the links. Warna phir de tumhara jhoot na pakora jaye 😂,1,2,1604114265.0
