comment_id,comment_parent_id,comment_body,comment_depth,comment_score,comment_created_utc
h9bmrj3,t3_p6a0ag,Truer memes have never been spo... err created,0,129,1629227960.0
h9c7ffp,t3_p6a0ag,Our Paki boys are more concerned for the dollars coming back home than consolidating their local currency by strong taxation and ease of business,0,37,1629236615.0
h9dmsfl,t3_p6a0ag,"As an overseas Pakistani, i see the majority of our youth is not that aware of the situation. Our middle aged generation (at least the majority) is busy finding employment to make their ends meet.

The majority of the generation born and raised in overseas, especially western countries have little to relate with Pakistani politics of socioeconomic problems.

I don't think we should label opinions as local or foreign. Every opinion should be treated as an opinion, and nothing else.

The problem is when that false opinion becomes an international narrative, and that is where the local media is to blame. Our authors, writer, poets, artists, director, actors, religious personalities need to step and and create work of art, such as films and shows, that can help Pakistan create a narrative before India paints a picture for the world.

We need to tell our own stories.

Why are Indians making movies before us, especially on topics like Mughal History, Mohenjo Daro, Ghalib, etc etc. Why haven't we made a single piece of electronic media on our own version of the story and presented it to the world.

We need to realize the power of story telling and use it in creating good films to establish a Pakistani perspective of things. We need to stop copying India in our TV shows and movies.

Rant over.",0,23,1629264073.0
h9brxdg,t3_p6a0ag,"The fact that remittances are the biggest number on Pakistan’s balance sheet should be a moment of shame for all Pakistanis.

But unfortunately people in Pakistan are more concerned about being considered the most ideologically pure amongst a group of people that more or less thinks just like them rather than adopt pragmatic and innovative thinking that leads to ideas that generate revenue.

Play stupid games, win stupid prizes.",0,140,1629230124.0
h9bnab4,t3_p6a0ag,This is the greatest meme I've seen in a while,0,58,1629228182.0
h9cq8a0,t3_p6a0ag,"American born in PK here. My father gets $1800 a month from the US govt for social security pension, and sends his older brother living in Hyderabad $200 a month. Been doing that for many years, even before he retired.",0,23,1629245714.0
h9bv511,t3_p6a0ag,"Funny to see comments from locals justifying it. Reality is overseas Pakistanis have a much better idea of governance & workplace etc then locals which are still mentally 20-30 years behind developed countries. It's quintessential to listen to expats and get their expertise in every field to advance Pakistan forward. China actually did that and developed much faster than any other country in history.

For an example, Balochistan had anti-Punjab movement in 70s and they gladly expelled virtually all punjabi professionals and teachers (my family was part of that expulsion). As a result they got left behind in every single field, now even when they want to get experienced people from punjab to work/teach there people are afraid to go, and now they blame central govt for their under development \*smh\*",0,80,1629231426.0
h9bsx0p,t3_p6a0ag,where is the lie,0,11,1629230525.0
h9diyr3,t3_p6a0ag,"Local Pakistanis need to understand something instead of always shutting down our opinions.

When you live in a country where things are running much better than they are in Pakistan, you gain a new perspective.

You realize that there are better ways of doing things and of thinking about things.

You become frustrated as you see all the things Pakistan continues to do horribly wrong.

Where is the Land reform? Every country that grew economically did land reforms.

What's up with the education system? A literate and educated population is a must to be competitive.

What kind of country excommunicates an entire sect in their constitution? Nobody does that.

What kind of country fires an economics adviser because Mullahs who don't know the first thing about economics demanded his resignation? This was an international embarrassment.

There are plenty of other Muslim countries. But in those countries, the mullahs don't determine government policy and the government keeps control of them. Extremist clerics are dealt with; not allowed to fester like Pakistan.

We prioritize religion to the point of toxicity. Imran Khan claims to understand the West but he compares Holocaust denial to the prophet being insulted. He embarrassed us on a global stage by saying this stuff.

And finally, democracy doesn't work when your population is illiterate and uneducated.  You need a leader with the actual authority to push through much needed reforms if you want your country to develop. When you are a developing country like Pakistan, you cannot fire a world-class economics adviser because illiterates on the street are demanding it.

So local Pakistanis, understand one thing. When we overseas Pakistanis tell you that Pakistan is a shithole that can do 100x better, that is because we have experienced both Pakistan and other countries. We know that there exists better ways to do things. We love Pakistan and so we want it to be better.

Don't get so offended and maybe listen to what we say. This country is decades behind others and will never catch up if it remains so closed-minded and bigoted.

I know local Pakistanis are going to downvote me heavily because they can't handle constructive criticism of this country and have an overly Rosy view of it.

But this is the truth you guys need to hear.",0,18,1629261328.0
h9ehm7h,t3_p6a0ag,"Over seas Pakistanis are privileged people,Not that I hold that against them,Im happy that a large part of our population was able to make a better life for themselves abroad,but then its the superiority complex that gets to me,that they are doing a huge favour to Pakistan by supporting their families and want everyone to know.",0,3,1629289921.0
h9cvfn2,t3_p6a0ag,"If you're sending money back home to your family, its actually helping your family more than the government really. 

Here in Pakistan though, we're used to just relying on other people's money/help unfortunately. So overseas or not, kamane wala ek aur khane wale 10. Everyone needs to do their part for real progress to happen.",0,6,1629248398.0
h9dv9l8,t3_p6a0ag,"I don't doubt the intentions of oversees Pakistanis, but here are a few issues I have found with them:

1. They are not aware of the ground realities of Pakistan and think that their life experiences apply to Pakistan and Pakistanis. A small example of this I saw on this subreddit a while ago was where someone was recommending not buying a car because they lose value as soon and they drive off the lot. Which is true for the west but the reality is the exact opposite in Pakistan.

2. They only hear the rosy promises made by the politicians and do not have to live with the consequences. They fundamentally have a lot less at stake politically and economically than someone whose life is in Pakistan and many of them do not respect that fact.

3. They do not assimilate into the societies they are a part of and look down on them. ""Gorey ghaleez hotey hein"", ""goron ko rishton ki tameez nahi hoti"" etc are things we have all heard. They live in silos and look down on their host countries while also continuing to live there which is just hypocritical and hurts the image of the entire country.

4. They think sending remittance gives them a direct say in the country's politics. Which makes little sense because if the country was doing bad economically they would be the group that would benefit the most from it because of exchange rates. Again, remittance is great for the economy and a necessity even, but it is not sent for the good of the country. That is a welcomed side effect of it.

5. Realted to all of the above, they are in an identity crisis where they are not willing to accept their adopted countries as their own even if they were born there but are also ignorant about life in Pakistan. Which leads to an overt display of patriotism that results in more problems and ignorant opinions that those living in Pakistan find laughable and sometimes offensive.

6. Also, minior grievance, they keep investing in property instead of businesses and drive the cost of land up for the local population which actually needs the land to make homes.

Disclaimers:
These are all generalizations, of course and all this is coming from someone who plans on moving abroad permanently in a few years.",0,6,1629271205.0
h9dxis7,t3_p6a0ag,"Do these overseas Pakistans send their dollars back for everyone in Paksitan? No!!!! They send dollars for their family…so sure they can give their opinion to their family, but not the rest of the country! First come live in pakistan and see the ground realities that we have to face on the daily, then share your opinion.",0,8,1629273288.0
h9bs8dx,t3_p6a0ag,"1 - You send money to your relatives, not us. Yeah the economy benefits from it, that I will agree it, but the same can be said when y’all take your money abroad, causing depletion.

2 - We dont hate you for giving your opinion. This is your country as well and you have every right to give an opinion. However, we just hate it when you start policing us and give us lectures about patriotism while living abroad. Recently I was talking about how extremism was rising in Pakistan, and one man replied “Leave this country if you hate it so much. Pakistan is not for libralzzz and seculars”. I checked his profile and guess what, he lived in Toronto :) 

There are countless other cases like this.",0,28,1629230248.0
h9btz7d,t3_p6a0ag,"Opinions should be criticised on merit, paisey bhejo gey to baap banalein?",0,9,1629230955.0
h9bs5wt,t3_p6a0ag,LOVE THIS!!!!  This is totally me.,0,5,1629230222.0
h9bs7d8,t3_p6a0ag,Facts,0,4,1629230237.0
h9bupl4,t3_p6a0ag,TRUE,0,3,1629231253.0
h9bn4bs,t3_p6a0ag,You should only give what matters,0,5,1629228112.0
h9br1t7,t3_p6a0ag,[deleted],0,7,1629229761.0
h9bq3t7,t3_p6a0ag,They give thier money to their relatives. Not us. And before you say it impacts our reserves I will point out that the same people take their wealth with them when they leave and deplete our reserves.,0,6,1629229375.0
h9byn7c,t3_p6a0ag,True asf!,0,2,1629232869.0
h9es1hb,t3_p6a0ag,"overseas Pakistanis are one of the most ignorant fucks out there. Absolut no knowledge of the ground reality, but the self righteousness of these people is truly commendable. Mariam u speak in an American accent and hang out with gore today just bcz your father was an illegal immigrant, Stop thinking you're the shit or any superior to a regular Pakistani",0,2,1629295469.0
h9bwwms,t3_p6a0ag,Thank you OP for making me laugh like a fucking donkey,0,3,1629232152.0
h9dvszj,t3_p6a0ag,"We appreciate the remittances and listen to your opinions.

But honestly, are you donating that money to the government of Pakistan or sending it to your family? Why do overseas Pakistani think we should worship them for sending their own family money?

Also some people in this thread are suggesting they know governance and the systems in Pakistan better than Pakistanis. Of course you have insight on a more developed system but many of these suggestions are downright insulting.

Carry out land reforms??? Increase literacy??  
Oh shit. Why didn't we think of that.

We have been trying to improve this system for decades and feel like overseas Pakistanis think we have a grand sum of 2 brain cells.

I love all Pakistanis, and appreciate all that you do for us. And of course you have unique perspectives. But please appreciate that the knowledge we have from actually living here cannot compare to arm chair analysis from abroad.

No hard feelings I hope. Thank you",0,3,1629271697.0
h9ckrl4,t3_p6a0ag,"Overseas Pakistanis are just dollar mules for Pakistans government, Change my mind!",0,2,1629242937.0
h9djdon,t3_p6a0ag,"If he doesn't make dollars, he doesn't make cents.",0,1,1629261615.0
h9br3c7,t3_p6a0ag,"Haha good meme

But seriously, stay away from issues  that dont affect you directly- like telling us how we should take refugees. You shouldn't have a say in that sitting overseas.

Don't wanna sound ungrateful tho, your dollars is one major reason economy is on the mend, so bari nawazish hamaray overseas ki.. aap log hamara keemti asasa hai lol",0,-1,1629229778.0
h9cbi1e,t3_p6a0ag,"I agree with this sentiment whole heartedly, because it is true in my experience. My own family in Pakistan is like this. Lol",0,1,1629238473.0
h9dn06b,t3_p6a0ag,Thank you for artificially pumping up the economy! I can't afford a house since all of you are dead set on investing in plot files and have thrown us out of a middle class lifestyle,0,1,1629264239.0
h9e3jo1,t3_p6a0ag,Then OP should keep their money,0,1,1629279052.0
h9bmrf3,t3_p6a0ag,OP is an idiot sandwich.,0,-10,1629227959.0
h9bn8tr,t3_p6a0ag,Overseas Pakistanis are retarded especially the UK ones,0,-16,1629228165.0
h9bnsj1,t3_p6a0ag,Or Euros or Pounds or Dirhams,0,-3,1629228398.0
h9cdyfy,t3_p6a0ag,"""What do you want a f***king medal?""",0,-2,1629239628.0
h9clyug,t3_p6a0ag,Yall send money to your families not us 🤦🏻‍♀️,0,-9,1629243534.0
h9brgu3,t3_p6a0ag,Stfu donkey,0,-10,1629229934.0
h9c2vxp,t3_p6a0ag,Is there Pakistani meme stock?,0,1,1629234633.0
h9cpxcr,t3_p6a0ag,"you glorious bastard! have an up vote, for i have felt that joy and sadness .",0,1,1629245557.0
h9cspr7,t3_p6a0ag,Fact,0,1,1629246995.0
h9cz766,t3_p6a0ag,Damn someone please explain this one to me ...,0,1,1629250302.0
h9e1wx4,t3_p6a0ag,"aka

Dollar halal, vote haram",0,1,1629277490.0
h9e2c0g,t3_p6a0ag,Overseas Pakistanis are abnormal!?,0,1,1629277903.0
h9esw68,t3_p6a0ag,😂😂😂😂,0,1,1629295882.0
h9g0v6i,t3_p6a0ag,I think most of those overseas pakistanis have left after stealing money from pakistan.,0,1,1629315636.0
hbnrnfq,t3_p6a0ag,Jai hind dosto,0,1,1630823494.0
hczb3tm,t3_p6a0ag,My favorite part is that if you can’t speak Urdu well people automatically assume that you have an IQ of 20,0,1,1631730291.0
hdf3dpm,t3_p6a0ag,Pretty much,0,1,1632021746.0
hdf3ta8,t3_p6a0ag,"I think the large majority of remittances that are sent back to Pakistan are from our Labour force in the gulf states.

Opinions sirf west main rehna waly apny overseas loug dety hain",0,1,1632021949.0
h9bz2xn,t1_h9bmrj3,Wait! Wait! My popcorn isn't ready!,1,25,1629233049.0
h9cfk03,t1_h9bmrj3,"This is exactly what I just said lol, damn, so spot on.",1,5,1629240407.0
h9dptxr,t1_h9bmrj3,Wat?,1,2,1629266482.0
h9e3mee,t1_h9c7ffp,This. Remittance is looked at as a shinning achievement.,1,7,1629279124.0
h9eh2z3,t1_h9c7ffp,"Its very hard to get people to give taxes,If you've ever visited the main shops of Pakistan,you'll notice that none have those micro ATM's,these are well educated middle class people,that will give gaalis to IK and the army,saying that they are citizens who pay tax when the time comes",1,3,1629289592.0
h9fkzjq,t1_h9c7ffp,And by strong taxation you mean not scrutinising those who dutifully pay their taxes and not letting many who evade taxes get away with their crimes?,1,2,1629308525.0
h9gyiik,t1_h9dmsfl,shouldn't we make movies on umayyads too?,1,2,1629331118.0
h9cmc7s,t1_h9brxdg,"Pakistani American here - I think almost every month I'm sending money to support one family or another in Pakistan. This is money I could be spending on my habits here, but I know that the living conditions of folks over there could be improved for the same price as a violin lesson here.",1,39,1629243721.0
h9c70au,t1_h9brxdg,">Play stupid games, win stupid prizes.

Is that a quote from Kraut?",1,7,1629236427.0
h9d13c7,t1_h9brxdg,this sub is slowly turning into r/canconfirmiamindian,1,3,1629251259.0
h9e3rzy,t1_h9brxdg,This. Whats the point of this ideology when income and expenses dont line up and the country is in this perpetual hole.,1,1,1629279265.0
h9diy19,t1_h9cq8a0,My father paid for the wedding of all 8 of his siblings 🤦🏻‍♂️,1,12,1629261314.0
h9cnu6k,t1_h9bv511,"That was the same time my grand father moved from Kalat to Punjab. This might have been a factor in moving from there, although he never mentioned it, so I am not sure.",1,13,1629244495.0
h9c20h0,t1_h9bv511,If you don't mind can you explain the expuslion part and how your family got affected because of the hatred.,1,2,1629234262.0
h9eig5h,t1_h9bv511,"China advanced because of rhe CCP,The expat community might be one of the dumbest bunch of educated Pakistanis(Not all of them),They think just because they travelled to a foreign land every thing they say must be right,Well we have educated people in Pakistan too,some people are a 100 years behind in Pakistan mentally,That dosent mean that you're the sole source of opinions and expertise",1,1,1629290428.0
h9bwxfm,t1_h9bv511,China developed fast because they have a hardworking culture with smart people and leaders who want to forward their nation not like Pakistan. Balochistan is still underdeveloped because of the central government focusing most development on lahore and karachi while leaving balochistan underdeveloped. They aren't even linked to the national grid and require electricity imports from iran.,1,-1,1629232161.0
h9dvv7i,t1_h9bv511,"This is exactly the kind of bullshit I'd expect from an ignorant oversees Pakistani. Bhai we are not all dumb. We have highly educated people. We have people who have lived around the world and are now living in Pakistan. The problem is not that we are ""mentally 20-30 years behind developed countries"". The problems are systematic and lie within the 90% of the population jin pe apkey precious perspective ka koi asar nahi ho ga. Everything you thin you can offer, we can get that from people living in Pakistan who have experienced it frist hand. Aap apne fazul k opinions aur superiority complex apne paas rakho humein nahi chahiye.",1,-1,1629271751.0
h9dxl6f,t1_h9bv511,"Hahahaha, why dont you come back and run the country then since you clearly are sooo much smarter than us all 🙄",1,-3,1629273352.0
h9on474,t1_h9diyr3,"As an overseas Pakistani, nah, most of us are,dumb af and,have serious superiority complexes. Also, especially for people that used to live in Pakistan, you instantly flip and start worshipping everything that happens abroad because you saw a bunch of trees and roads that aren't designed like a Mario Kart stage. Some points are valid, but most of the people that then come to Pakistan and try to use their brilliant understanding here realize quickly that they're out of their depth.

You can't claim to know how to fix a country without knowing its soul, and chances are even if you are from Pak living abroad, you're privileged af , even living in Pakistan you didn't actually know shit about it outside your bubble.

Pakistan is no doubt a shithole, full of narcissistic assholes and corrupt , greedy pieces of shit at every level but you don't fix that by becoming america. Or europe. Hell what America has going on isnt going too well for america atm, the place is borderline unlivable without a well above average salary atm.",1,3,1629479283.0
h9dwdlc,t1_h9diyr3,"Lol, I am an overseas Pakistani, and I can honestly say whatever this guy is saying is full of sh**. Oveeseas Pakistanis are not a monolith, nor are they automatically experts at good governance just because they live overseas. As demonstrated above, some of them are really, really not that that bright, yet think they know better.",1,4,1629272217.0
h9efk0o,t1_h9diyr3,">he compares Holocaust denial to the prophet being insulted. He embarrassed us on a global stage by saying this stuff.

Oh, I'm sorry how was that embarrassing in any away?

He rightly pointed out how mockery of the Prophet is as sensitive  to us Muslims as the denial of Holocaust in the West. If its a crime hurting sentiments of the Jews, why double standards for Muslims then?  Agree with most of what you said but this one's beyond ridiculous.",1,-2,1629288623.0
h9e6yqe,t1_h9diyr3,"Fuck off with land reform, don't you dare touch my fucking zameen",1,-7,1629282132.0
h9hgnyv,t1_h9dv9l8,">this is coming from someone who plans on moving abroad permanently in a few years.

Just like most if they could.",1,1,1629339704.0
h9c4u44,t1_h9bs8dx,"It's not even about Patriotism. Pakistan just comes across as backwards due to the state of News channels, Dramas and absolutely pathetic politics.

Obviously Pakistanis are not all like that, but 99% of the content being outputted is ridiculously bad for Pakistans image.",1,13,1629235481.0
h9cmpoy,t1_h9bs8dx,"Re 2, there’s a comment on this thread right now saying overseas Pakistanis apparently now have a better idea of governance than locals. Because apparently were stupid and don’t understand what good governance is. This superiority complex amongst overseas folks is why many of us are annoyed by their opinion. And when 16 year olds start giving their opinions on our culture and our country without having ever stepped foot in pak, or atleast never having been outside of bahria, just. No. Stop. Just stop",1,14,1629243915.0
h9bvohu,t1_h9bs8dx,There is truth to #1. If the family moves abroad with them the remittances stop right away,1,12,1629231645.0
h9byy3w,t1_h9bs8dx,"Like the other guy said, taking money out of Pakistan is miniscule, only corrupt politicians pull that tomfoolery. More people send money to Pakistan in fact remittances are a major source of economic boost in Pakistan.

Edit: The Pakistani government asks for donations from overseas Pakistanis examples being 3 years ago Imran Khan asked overseas Pakistanis to donate money for building a dam.",1,8,1629232994.0
h9buav8,t1_h9bs8dx,Chill bro it's just a meme and i also live in Pakistan,1,5,1629231087.0
h9dt6o8,t1_h9bs8dx,Well some of them do have a point. Being a devout muslim here in the U.S is difficult as there is more temptation to commit sin. So when we look at Pakistanis who never lived abroad advocating or fetishizing for open sexual society or the western version of feminism. We tend to become critical. There is a whole group of burger elite from Karachi talking down on Imran Khan for everything.,1,2,1629269337.0
h9bzq94,t1_h9btz7d,"Well the thing is opinions are not criticised on merit. Look at someone who was one of the best economics, but was not allowed in the government due to his religious views. Or even an better example one where an ex-Google employee was not allowed on a high rank position due to her nationality. So the idea is if you don't want our opinion, don't take the money either.",1,2,1629233317.0
h9bzpo2,t1_h9br1t7,Lol bullshit. Ask any Pakistani abroad how many times their family gives relatives money back home. Nearly every diaspora family does it.,1,22,1629233310.0
h9bznfj,t1_h9br1t7,That’s still money spent in Pakistan economy……,1,18,1629233285.0
h9dl5xs,t1_h9br1t7,[deleted],1,5,1629262875.0
h9c0hlv,t1_h9br1t7,And guys listen to this - Imran Khan was asking donations FROM overseas Pakistanis like 3 years ago to help build a damn. Not the first time the government has asked for overseas donations either.,1,7,1629233629.0
h9c3z0j,t1_h9br1t7,Economics 101 net remittance is positive so money comes into the country. Really fostering some geniuses over here at r/Pakistan,1,5,1629235103.0
h9dxpf8,t1_h9br1t7,Exactly!,1,2,1629273466.0
h9bvmdb,t1_h9br1t7,They can “spend” them by other means,1,5,1629231622.0
h9c2i9x,t1_h9bq3t7,"$30 billion in remittances last year. More than our entire export of goods and services. 

When someone starts an export business selling textiles, they are doing it to support their family.",1,15,1629234472.0
h9c3t5h,t1_h9bq3t7,Net remittance is in the billions meaning remittance is higher than depletion.,1,10,1629235033.0
h9bzd5j,t1_h9bq3t7,"Maybe you should also mention that remittances are much higher than depletion.

Also, if I'm not mistaken I remember an advertisement where Imran Khan was asking donations to a build a damn 3 years ago FROM Overseas Pakistanis. Not the first time either. Dude shows off remittances to the country.",1,7,1629233167.0
h9c1kef,t1_h9bq3t7,"So you want them to just donate to Pakistan? Only then you’ll appreciate it? Every tax payer in Pakistan should be appreciated, every overseas Pakistanis who is remitting to whomever should be appreciated and….. Malala ;)",1,7,1629234076.0
h9ctqnl,t1_h9bq3t7,"You do understand that money circulates in the economy, right? That remittance money goes to a family, who uses it on basic needs, like buying groceries. The people who run the grocery stalls don't have family abroad, yet they still benefit from the money in a second-hand way. Essentially, it helps you indirectly, whether you like it or not.",1,7,1629247526.0
h9bsw2d,t1_h9bq3t7,Most Pakistanis abroad are daily wagers in gulf countries working their asses off while their families at home sit on their asses doing nothing.,1,19,1629230514.0
h9bt4u5,t1_h9bq3t7,Are their relatives lesser Pakistanis because they get remittances from their family members abroad?,1,5,1629230614.0
h9fcq76,t1_h9es1hb,Very much agreed,1,0,1629304888.0
hczbwla,t1_h9es1hb,Idk about this Mariam bro but every time I went to Pakistan and people found out that I was from America they would constantly try to make everything a competition as if trying to prove to me that they are the superior one lmfao. So it goes both ways.,1,1,1631730621.0
