comment_id,comment_parent_id,comment_body,comment_depth,comment_score,comment_created_utc
h9ej3i7,t1_h9e3jo1,"Bro i live in Pakistan, i made this meme because I've seen many times our prime minister praising and thanking overseas Pakistani because they give us dollars. But also their opinions are considered irrelevant here and they are always get criticized for that",1,2,1629290809.0
h9btkwa,t1_h9bmrf3,r/rareinsults,1,-3,1629230795.0
h9bos1f,t1_h9bn8tr,"As an overseas Pakistani, I can unfortunately confirm


Don’t get me wrong, I love my country. I plan on moving back as soon as possible, bas i’ve been living somewhere else my whole life.",1,17,1629228816.0
h9bpg3x,t1_h9bn8tr,What’s ur problem with us?,1,4,1629229096.0
h9cmwwk,t1_h9clyug,And what do you think those families do with that money? Don't tell me they spend it in your economy?! 😲🤯,1,8,1629244019.0
h9e4hln,t1_h9clyug,Exactly,1,1,1629279919.0
h9hhwfc,t1_h9g0v6i,I think you should get your brain checked. Those are your corrupt politicians not overseas Pakistanis.,1,1,1629340316.0
h9h04vd,t1_h9gyiik,"If you have a credible story and a strong story teller, who is to stop you?",2,2,1629331879.0
h9cqtmm,t1_h9cmc7s,"Yeah. I send a meager amount in remittances to my dad's side of the family (moreso for them than my mother, since they do farm work) and that has dramatically improved their lives. They've been able to retain all their land, make emergency purchases, and update certain parts of the community (installing solar panels, investing in better farm tech, etc.). They've also become less hesitant visiting hospitals, since it has become affordable for them, which has helped out many times.",2,35,1629246015.0
h9e2fxe,t1_h9d13c7,How?,2,2,1629278007.0
h9dttyf,t1_h9diy19,"Expat Pakistani fathers are the greatest victims of emotional blackmail I have ever seen. Mine has sent countless amounts of money (many times that we didn't even have), phones, laptops, medicine, tech, and even paid for umrah of extended family - - I have to say it's something I despised him for when I was younger, less now",2,14,1629269903.0
h9e5l8u,t1_h9diy19,My father and his younger brother paid for the weddings of all five other siblings and the majority of those siblings' kids. Now my brother and I are pressured to help with our cousins' weddings. I'll pitch in 50k rupees but I refuse to buy entire dowries like my dad and uncle have been doing for years.,2,3,1629280913.0
h9c9lt1,t1_h9c20h0,"My family is Punjabi origin, and my grandfather was a civil servant living with his family in Quetta since the 50s. In 60s the Baloch leaders started doing ethnic politics i.e. Punjabis are coming here and taking our jobs etc, this caused massive tensions among the two groups and there were incidences of attacks/killings of Punjabi people. They weren't specifically targeting army associated people (it wasn't a separation thing), any Punjabi was fair game i.e. doctors, teachers etc. Coupled with that the backward ugly mindset of feudal/tribal leaders of even picking up random women from street for their pleasure, my grandfather even stopped girls of the family from going outside the home during that time.

Because of the deteriorating situation in Baluchistan, I don't recall clearly but I think it was the governor of Punjab who offered govt jobs to punjabi people back home. So most of the Punjabis moved back selling out their houses etc at below market rates to just get the hell out.

I've been told this story since childhood, this is why I find it funny when I see posts that central govt is responsible for backwardness in Baluchistan. It's the a55 backwards tribal leaders like Bugti that destroyed the future of Baloch people and stopped them from getting education and progressing. Not only that, for their own petty politics they created ethnic divide that lasts till this day!",2,19,1629237598.0
h9c9jt6,t1_h9bwxfm,"> central government focusing most development

> karachi 

Lmao",2,19,1629237573.0
h9bxebx,t1_h9bwxfm,Thanks for proving my point!,2,8,1629232355.0
h9c3oe0,t1_h9bwxfm,">hardworking culture

Don't you mean paying their workers practically nothing at a young age because families need to be kept afloat?",2,3,1629234976.0
h9hfgcj,t1_h9dvv7i,opinions aur superiority complex apne pass hi rakho bas paise bhejte jao.,2,1,1629339113.0
h9ebj66,t1_h9dxl6f,"Tell the local feudal lords masquerading as politicians to stop sending us death threats, then perhaps some of us would. Why do you think we all love Immy?",2,6,1629285838.0
h9ec4gq,t1_h9dwdlc,"You're partially correct, though I'll admit there is a flair of a superiority complex going around which is equally obnoxious, I'd be the first to admit I'm not blameless for this attitude myself. But Bhai, you have to understand that overseas Pakistani, especially those of us from Europe and US generally do learn how things run better and try to push for those reforms back in Pakistan. Most may not know how to necessarily govern, but they know what it'd take. It's an educated electorate for the most part, though you'd be correct, we're not a hive mind or monolith, disparities do exist, that isn't a case for the dismissal of our opinions though. The fact that remittances are the biggest paycheck for the national coffers should tell you that. 

However, I feel empathy for the mistreated expats in the gulf states. Fuck those countries.",2,3,1629286273.0
h9fnosk,t1_h9efk0o,"It's not ridiculous. What Imran Khan did proves that he does not understand the West one bit. 

In the West, religious figures are often seen as fair game for criticism. They are viewed as any other historical figure so criminalizing their criticism sounds ridiculous to the West.

Secondly, saying ""It causes hurt because he is dear to me"" still sounds ridiculous to the West. Imagine making it illegal to criticize someone's parents ""because they are dear to me"". From the POV of the West, trying to ban criticism of a specific person makes you seem overly fragile.",2,2,1629309714.0
h9fmonh,t1_h9e6yqe,"Mao killed nearly 15 million landlords in order to enable his land reform program. To this day, the Chinese practically worship him.

We need a Pakistani Mao.",2,2,1629309270.0
h9d4e02,t1_h9cmpoy,We're,2,0,1629252942.0
h9c0byp,t1_h9bvohu,[deleted],2,12,1629233565.0
h9c01op,t1_h9byy3w,Well you have a very good point. I am also in favour of foreigners not being allowed to vote in Pakistan (I don't live in Pakistan). For the exact reason you gave. I have seen this with Turkish friends who vote for Erdogan but don't feel the falling Lira in their pockets.,2,5,1629233447.0
h9dvc7x,t1_h9dt6o8,Tou waapis aa jao na bhai aap ko kon rok raha hai?,2,3,1629271272.0
h9cmmoc,t1_h9bzq94,"Lol, it had nothing to do with her nationality, it had to do with her corruption and the company she set up with a known corrupt goon in order to commit fraud. 🙊",2,3,1629243871.0
h9dup72,t1_h9dl5xs,"No, you don't get it. When those families get their remittance money, it just disappears into a black hole never to be used again! Just trust me, I'm an expert in Chawwal-nomics like a ton of users here!",2,3,1629270684.0
h9cmwrf,t1_h9bvmdb,"Yes, they’ll stop giving dadi amma money for her diabetes medication because someone hurt their feefees on r/Pakistan 🤦🏻‍♀️",2,5,1629244017.0
h9c01c6,t1_h9bsw2d,I don't think those people have time to comment on reddit that why should Pakistan take in refugees.,2,1,1629233443.0
h9d5rjd,t1_h9bsw2d,Someone's been watching Pardes,2,1,1629253658.0
h9buf8i,t1_h9btkwa,So rare. Never heard of it before,2,5,1629231136.0
h9cmrm1,t1_h9bos1f,Same.,2,1,1629243942.0
h9bzkh8,t1_h9bpg3x,They ain't us. 🤜💥🤛,2,3,1629233252.0
h9bsfz3,t1_h9bpg3x,Anjum chodhary for starters,2,-3,1629230333.0
h9cn7me,t1_h9cmwwk,It’s still not a favor to me? Like why exactly should I care if they’re sending money to their families? If their opinions are stupid their opinions are stupid,2,-7,1629244176.0
h9hibzw,t1_h9hhwfc,"Politicians,military men, godmen, buisnessmen.
Everybody steals.
Some get caught. 
Some dont.",2,1,1629340526.0
h9ctt9d,t1_h9cqtmm,"If it brings progress to our community back home, always happy to help.",3,20,1629247563.0
h9e3mv0,t1_h9e2fxe,"If you click on this r/canconfirmiamindian and keep looking at the screen and making the page move up and down slow enough to read, you'll see Indians saying things like 'libtards' and 'westernized mama's boys' and 'can't even speak hindi properly' and 'i bet if i asked them they couldn't name like 4 hindu gods'.",3,1,1629279135.0
h9du9ig,t1_h9dttyf,"Especially if you're the eldest one in the family. Everyone else just depends on you. My father pulled everyone off their asses and out them all to work also. Went out of his way to put them first, sometime, like you mentioned, even over his family. Alhumdulilah for everything though, when you ask them, why they did all that. They just say, you should help and never expect anything in return. That is a quality that is diamond and not something that everyone possesses. May Allah grant our parents with long healthy lives ameen.",3,8,1629270283.0
h9eazwr,t1_h9dttyf,"Mine too, biggest strain of his marriage.",3,2,1629285441.0
h9e6342,t1_h9e5l8u,"I only support my own family, screw cousins and etc bruh that's messed up 😂🤦🏻‍♂️",3,2,1629281359.0
h9cel8b,t1_h9c9lt1,"Thanks for giving such a detailed response. I found out about what happened to Punjabis in Balochistan during that era just recently , how punjabi population in Quetta was nearly wiped out  and I was surprised none of us in Punjab knew about it.",3,9,1629239932.0
h9dlavh,t1_h9c9jt6,lmao I wish what the guy said was true. Karachi seems to get worse every time I go lol.,3,4,1629262973.0
h9i4qgu,t1_h9hfgcj,Ye nautanki band karo. I dare you to not send remittance.,3,1,1629354271.0
h9ec21g,t1_h9ebj66,You think we dont receive threats? Everyone’s life is in danger in Pakistan. Did you think Jinnah’s life was safe when he decided to fight and get a separate country for us? If you’re that passionate about your country then you should be willing to give your life for your country. Its easy to run away and become a keyboard warrior from your home abroad.,3,-5,1629286223.0
h9f9qzs,t1_h9ec4gq,"The issue is that diaspora who think""things run better"" is already a flawed way of thinking. For the most part, Pakistani diaspora, especially those who are rich enough to send remittances, enjoy a certain type of class privilege that largely makes them white adjacent in many ways. That doesnt necessarily  mean they know what is best for all Pakistani in Pakistan, especially when they have no experience of some of the harsher realities of being poor in Pakistan.

Just because one policy worked for you because you have enough money and privilege to not be greatly affected by it doesnt exactly mean it is good for all the people of Pakistan. Diaspora Pakistanis really need to face reality.",3,1,1629303575.0
hbrrn81,t1_h9fmonh,"Yep kill all the landlords............

Someone's a bit pissy they got no zameen",3,1,1630901447.0
h9c62z0,t1_h9c0byp,"Only if they live in gulf countries, they mostly dont return from western countries though",3,6,1629236026.0
h9c7t1l,t1_h9c0byp,"Maybe, but the land/housing/etc. one only happens if they still have close family in Pakistan. Once they are not there that stops too. 

And investing in land/housing is not done ""for the benefit of the country"" - leaving unused plots/housing doesn't help the country in any way. If they were serious about helping the country they would invest in organizations and helping the poor",3,5,1629236784.0
h9dx9d2,t1_h9dvc7x,"Let's see

1) Corruption,

2)  lack of high paying jobs

3) Need of an updated infrastructure

Unfortunately some burgers think that all these problems are because of Islam and if that just went away, tomorrow we would become murcia and free from all oppression.",3,3,1629273037.0
h9ff9tk,t1_h9dup72,[deleted],3,2,1629305997.0
h9efvzx,t1_h9d5rjd,isn't that drama really well made?,3,1,1629288844.0
h9buhfc,t1_h9buf8i,What is wrong with you,3,0,1629231161.0
h9c3uz3,t1_h9bsfz3,"For every Anjem Choudary in the UK, there are at least 10,000 in Pakistan",3,3,1629235055.0
h9cninw,t1_h9cn7me,"Looks like you didn't understand the meme, which is saying that the general feelings of the country with regards to OPs is one way when they're sending dollars in (remittances inbound are the largest line item in the economy, btw, so it's not a small amount), vs when OPs share an opinion they have on the country. It's a double standard, a hypocrisy. 

No one is asking for you, personally, to kiss anyone's feet. 🙄",3,7,1629244332.0
h9hihez,t1_h9hibzw,Okay and how does that prove that most overseas Pakistanis left after stealing money?,3,1,1629340600.0
h9cu74r,t1_h9ctt9d,"Yup! It's nice to know that it really helps them live easier lives. The funny thing is that someone told me way long ago on here, when I cautiously revealed that I live in the U.S. that I am ""JUsT a diaSPorA KiD"" as if that somehow invalidates what I do and that my voice doesn't count. Very frustrating dealing with those people.",4,17,1629247760.0
h9cfbo9,t1_h9cel8b,"Probably because govt doesn't want to inflame ethnic tensions, so its all forgotten and never dug up.",4,9,1629240293.0
h9ecx4z,t1_h9ec21g,"Keyboard warrior? Fuck off. Try saying that when the local gangster has threatened all your family, has raided your home with thugs threatening to kidnap your women at gunpoint, threatened to forge papers to steal your house, who has powerful connections to track your phone etc. I've had my fair dealings in Pak to know how they work bro.",4,2,1629286850.0
h9e4bqe,t1_h9dx9d2,"prevalence of sin' and 'absence of islam' if you're choosing to stay there.

Everyday we see new atrocities against women and minorities here and overseas Pakistani warning us against the depraved west when we tell them we need feminism and improvement in women's and human's rights.

I don't think the absence of Islam will magically cure Pakistan but if Islam was the most important thing, more people would choose to live in Pakistan or an Islamic country instead of the west.",4,3,1629279768.0
h9ghtse,t1_h9ff9tk,"I suppose so. But this is basic economics. Money brought into the economy changes hands dozens of times, so everyone benefits. I don't see how this is such a hard concept for these guys.",4,1,1629323300.0
h9f1yju,t1_h9efvzx,"It is! Depressing for sure, but pretty good.",4,2,1629300094.0
h9c5sy8,t1_h9buhfc,Lots of things,4,3,1629235904.0
h9cod83,t1_h9cninw,"I understood the meme perfectly, and I disagreed with point 1. I don’t care if yall send money cause it’s for your families. You send money for your families, if your families didn’t live here you wouldn’t be sending money. But overseas Pakistanis ke superiority complex se Allah hi bachaye. Also the biggest remitences aren’t even coming from the uk/us they’re coming from the gulf labourers. Your opinions about Pakistan are still worthless to me ❤️",4,-6,1629244764.0
h9cv2l9,t1_h9cu74r,"Oh I get that all the time. ""You should keep your thoughts to yourself. What do you know of the situation?"" Well I can still give my criticism of things and help brainstorm ideas???? Maybe you can take some of my views to the local office or send it in a letter to the Prime Minister? Doing something is better than doing nothing or having an ""Kuch nahi badalna"" attitude.",5,15,1629248209.0
h9edirs,t1_h9ecx4z,"Its a shame what you faced, but how does that make you better at being able to manage this country? A country that you ran away from for your safety? Why are you going to be soooo amazing, and better than all those who chose to stay, at running it??",5,-1,1629287261.0
h9e6qes,t1_h9e4bqe,"Atrocities against women and minorities also happen in the west all the time. Have you heard of the me too movement? Hollywood has a whole thing with pedophilia going on and many child stars are beginning to speak up now. Now this is happening in a country where they prides themselves on ""freedom of speech and women's rights"". If you want to see a model of a country that has a similar culture but implemented feminism and secularism, look at India. I'm sure you're aware of their track record of women's rights and protection, especially lower income women. Islam already has human rights guidelines. If a bunch of Lahori kanjar insaan decide to catcall and harass a woman walking by, it's our job to make sure they are punished for their behavior and they understand what Islam says about this behavior not man if only feminism was Pakistan, this wouldn't happen.",5,0,1629281936.0
h9cz3ao,t1_h9cod83,"And if you didn't have Pakistani roots you wouldn't care about it. If you had family in Britain, you would care about them. If you had family in Angola, you would care about them. I don't see what your point is. It's like saying birds fly or water is wet. 

>But overseas Pakistanis ke superiority complex se Allah hi bachaye  
>  
>.....  
>  
>Your opinions about Pakistan are still worthless to me ❤️

Who seems to have the superiority complex here?",5,5,1629250248.0
h9e1jx0,t1_h9cod83,you really need to learn to talk less,5,3,1629277148.0
h9cq2rs,t1_h9cod83,Aight gg,5,1,1629245636.0
h9cwcb1,t1_h9cv2l9,"It's nice to feel validated by another Pakistani American on here. I hope you have a great day, dude.",6,9,1629248861.0
h9eeg2p,t1_h9edirs,"Bhai, I never said any of us are magically better at governance, I was insinuating some of us have a different perspective on things that shouldn't be ignored, not that we should magically and unequivocally be given the crown, I'm not asking for preferential treatment. 

When I said we all love Immy, I meant he isn't a chor daku, we want more people like him in. People like Sania Nishtar, Dr Moeed Yousuf, Tania Aidrus etc who all have that foreign experience that bring something valuable to the country. That's not to say the locals are stupid, that'd be extremely demeaning to my father, and my forefathers who fought hard to free Pakistan and Kashmir (some of my family hails from Chitral, have served the military for generations, including my father).

Edit: I was voicing my frustration due to all the corruption. Good people, regardless of being local or foreign, have been driven away or killed, I've experienced this personally, it makes you world weary. The ones that stay and live are hardcore, though they're always in danger, some good local friends of mine included. I'm one of the lucky ones that knows people who can protect us and keep us safe, relatively speaking. But I shouldn't have to, I shouldn't have to live in a gated community to feel safe. It's not fair on the average folk, who aren't as fortunate or privileged as I may be. 

So please don't entertain the fact that I'm some foreign snowflake, whose never been in a dangerous situation before, I take it personally because you don't know me or my life story. Tis not good to pass on stereotypes and caricatures.",6,2,1629287895.0
h9e7kmr,t1_h9e6qes,"The west also has atrocities against women and minorities in the same vein that it also has corruption. That is, significantly less.

India implemented feminism. Lol, what are you smoking bro. They did have a secular govt. and turning out much worse now that they're shifting to hindu nationalism.

I'm not saying Islam doesn't have these guidelines. I'm saying conservatives and religious elements have been resisting any improvements in improving women's  rights or minorities rights, or even breaking up feudalism in Pakistan.

If you have these feelings that the west is full or problems and Islam has all the solutions, by all means come back to Pakistan. But you won't because the institutions and the money they offer trumps any attachment to Islam you might have.

Or maybe you'd like to say the west is more islamic than Pakistan?",6,2,1629282665.0
h9cz472,t1_h9cz3ao,"Water is actually not wet; It makes other materials/objects wet. Wetness is the state of a non-liquid when a liquid adheres to, and/or permeates its substance while maintaining chemically distinct structures. So if we say something is wet we mean the liquid is sticking to the object.",6,0,1629250260.0
h9debjp,t1_h9cz3ao,I don’t think you understand how superiority complexes work. I can think someone’s opinions about Pakistan are worthless without thinking I’m better than them,6,0,1629258401.0
h9e1mhi,t1_h9e1jx0,So do you,6,1,1629277215.0
h9cxfwb,t1_h9cwcb1,"You as well, man!",7,8,1629249420.0
h9f0jnj,t1_h9eeg2p,"You might be frustrated however you really need to read before jumping on a thread. My comment was in response to someone saying overseas Pakistanis have a much better idea on governance which is completely baseless and extremely offensive to anyone living in Pakistan. How is anyone living abroad better than us at that just because of their location?
Furthermore i am a woman, with no feudal or powerful backgroud, living in Pakistan and facing all the challenges that are associated with living in this country. Hence i am also extremely offended by your constant assumptions regarding me. You at least have escaped whatever challenges locals face on the daily, i am still going through it all. You don’t want people stereotyping you? Then maybe don’t stereotype others as well.",7,2,1629299456.0
h9e9p0t,t1_h9e7kmr,"I stand by my statement. You're right, west is full of problems and Islam does have all the answers. Pakistan is not Islamic by any means. If it was, women would not be harassed, politicians would not be corrupt, there would be no feudalism.Crimes would not go unpunished. At least in theory it would have the crime statistics of a country like UAE or Qatar. I mean wasn't Pakistan formed so we could become a Muslim nation. I guess we could have saved a million lives and not fought 3 wars, if we were gonna implement secularism and just stick to India.",7,2,1629284437.0
h9cz7s8,t1_h9cz472,"Water makes things wet. Ok, I'm glad you could clear that up, bot. But my point still stands.",7,2,1629250311.0
h9e1ole,t1_h9e1mhi,Uhh that doesn't really make sense but ok,7,2,1629277270.0
havpgy3,t1_h9cxfwb,Been in and out of Pakistan most of my life. You guys are absolutely right about most of the things. Just remember that money is not the solution for everything.,8,1,1630289960.0
h9ievlg,t1_h9e9p0t,"I'm afraid I don't understand. What is your statement exactly? That the west is full of problems and Islam has all the answers?  
And I guess you are saying America is more Islamic than Pakistan?

Shouldn't you be looking for a way to move to a country like UAE or Qatar then at least? Where at least your tax dollars are going to a muslim government. Not a country which directly funds Israel at least.",8,1,1629362835.0
h9l3ho5,t1_h9ievlg,"West has more basic human rights than Pakistan for the time being. But that can change overnight. Look at the situation in France, remember the Muslim ban? So Pakistan needs to establish its self where Pakistanis can bring their financial assets back to Pakistan without the fear of wealth being stolen. We need basic islamic rights which Pakistan is not able to provide. UAE just recognized Israel recently, haven't you heard. They also don't provide citizenship no matter how many years you live there. The world is run by dollars and interest, even living in Pakistan, if I take out a loan, I would have to pay interest, which is against Islam. Yeah maybe I can move to Bahria town in Lahore and stay in a closed bubble and tell everyone how great Pakistan is, but that's hypocrisy.",9,2,1629409499.0
h9obpqo,t1_h9l3ho5,So you'd rather stay in the global hub of degeneracy and tell everyone how much we need an Islamic state?,1,0,1629474727.0
h9obrnn,t1_h9l3ho5,Kher. Sorry for the rude comments. You do you. Your life. Best of luck,1,0,1629474748.0
